id,title,summary,imgUrl,content,author,createdAt,tags,link,viewers,likes
61a420e4-0044-11ee-bbbb-bb155eb672e5,Tips Menjaga Kebugaran Lansia yang Perlu Diketahui,"“Seiring dengan bertambahnya umur, menjaga kebugaran tubuh agar tetap sehat menjadi tuntutan yang semakin penting. Untuk itu, penting mengetahui berbagai tips yang bisa dilakukan untuk menjaga kebugaran lansia.”",https://d1vbn70lmn1nqe.cloudfront.net/prod/wp-content/uploads/2023/04/12063013/Begini-Tips-Menjaga-Kebugaran-untuk-Lansia.jpg-1.jpg.webp,"Halodoc, Jakarta – Seiring bertambahnya usia, tuntutan untuk tetap menjaga kebugaran semakin penting agar tubuh tetap sehat. Selain untuk menjaga kesehatan tubuh, hal ini penting untuk tiap lansia lakukan agar memiliki umur yang panjang.
Berkaitan dengan hal tersebut, ada penyesuaian pola hidup yang perlu lansia lakukan agar kesehatan saat berusia lanjut dapat terjaga dengan baik. Simak berikut ini berbagai tips untuk menjaga kebugaran lansia!
Tips Menjaga Kebugaran Tubuh untuk Lansia
Saat beranjak menua, seseorang akan mengalami berbagai perubahan dari segi fisik maupun mental. Untuk meminimalisir efeknya bagi kesehatan, ini beberapa tips yang bisa lansia lakukan:
1. Tetap aktif bergerak
Banyak lansia yang hanya menghabiskan waktu berdiam diri saja di rumah. Padahal, olahraga ringan menjadi salah satu tips menjaga kebugaran lansia agar kesehatan fisik dan mental dapat terjaga dengan baik.
Dengan tubuh dan pikiran yang sehat, maka harapan hidup menjadi lebih panjang. Aktif bergerak juga dapat menurunkan risiko terjadinya penyakit serius, hingga disabilitas akibat pertambahan usia.
2. Melakukan diet sehat
Diet sehat bukan hanya bertujuan untuk menurunkan berat badan saja, tetapi juga menjaga kesehatan tubuh di kemudian hari. Kondisi seperti obesitas dan berat badan terlalu ringan akan memicu berbagai penyakit serius di kemudian hari. 
Untuk melakukan diet sehat, yang perlu lansia lakukan adalah memperbanyak konsumsi makanan sehat bergizi seimbang dengan takaran nutrisi yang tubuh perlukan. Selain itu, konsultasi dengan dokter juga bisa membantu menentukan diet yang cocok untuk kondisi tubuh tertentu.
3. Konsumsi makanan dan minuman sehat
Tips menjaga kebugaran lansia selanjutnya adalah mengubah pola makan menjadi lebih sehat. Hal yang satu ini perlu menjadi kebiasaan sejak muda agar tidak sulit untuk orang tua lakukan di kemudian hari.
Pola makan yang dokter sarankan adalah mengonsumsi makanan dengan rendah lemak jenuh, ikan dengan kandungan tinggi omega-3, gandum, produk susu rendah lemak, buah-buahan, juga sayuran.
Terkait dengan minuman yang baik untuk konsumsi, pastikan untuk memenuhi asupan cairan dengan banyak mengonsumsi air putih. Lansia juga bisa mengonsumsi teh, kopi, dan jus buah dengan sedikit gula. Sebisa mungkin hindari minuman yang terlalu dingin dan manis. Alih-alih membeli minuman manis dengan pemanis buatan, kamu bisa membuatnya sendiri di rumah agar terjamin kesehatan dan kebersihannya.
4. Beristirahat atau tidur yang cukup
Gangguan tidur menjadi salah satu masalah yang sering terjadi pada lansia. Berkaitan dengan hal tersebut, usahakan untuk memenuhi kebutuhan istirahat dengan tidur yang cukup. Jika memiliki waktu tidur berkualitas, hal tersebut akan berdampak baik pada kesehatan fisik maupun mental.
Adapun untuk tips tidur dengan nyaman, kamu bisa mengatur suhu ruangan hingga nyaman dan matikan lampu. Gunakan juga humidifier dan aromaterapi jika perlu.
5. Menjaga kesehatan kognitif
Menjaga kesehatan kognitif bisa kamu lakukan dengan bermain permainan yang dapat melatih ketajaman ingatan dan kemampuan berpikir. Beberapa jenis permainan yang disarankan, yaitu puzzle atau teka-teki silang.
Perbanyak permainan yang membutuhkan keterampilan berpikir setiap harinya. Melakukan hal ini bisa memperlambat penurunan kinerja otak dan risiko terjadi penyakit otak seperti Alzheimer dan demensia.
6. Lakukan pemeriksaan secara rutin
Tidak dapat dimungkiri kalau pertambahan usia meningkatkan risiko terkena berbagai penyakit berbahaya. Oleh karena itu, sebaiknya lakukan pemeriksaan rutin untuk memantau kondisi kesehatan secara berkala. Jika memiliki penyakit bawaan, lansia juga bisa mengonsumsi obat berdasarkan resep dokter secara rutin. 
Untuk detail lebih lanjut tentang penyakitnya, kamu bisa mencari tahu tentang 7 Penyakit yang Rentan Dialami pada Lansia.
Itulah sejumlah tips menjaga kebugaran lansia. Kalau kamu masih memiliki pertanyaan tentang gaya hidup, pola makan, atau keluhan penyakit terkait lansia, jangan ragu untuk langsung melakukan konsultasi lebih lanjut dengan hubungi dokter melalui aplikasi Halodoc. 
Sekarang kamu bisa berkonsultasi dengan praktis kapan saja dan dari mana saja. Tunggu apa lagi? Ayo download Halodoc sekarang juga!

Referensi: 
UMH.org. Diakses pada 2021. 5 Fitness Tips for Seniors with Limited Mobility.
NIH. Diakses pada 2021. Staying Motivated to Exercise: Tips for Older Adults.
Help Guide. Diakses pada 2021. Senior Exercise and Fitness Tips.",dr. Rizal Fadli,29 Mei 2023,"[""kesehatan"",""lansia"",""kebugaran""]",https://www.halodoc.com/artikel/tips-menjaga-kebugaran-lansia-yang-perlu-diketahui,0,0
61b5264f-0044-11ee-ac36-bb155eb672e5,"Jarang Diketahui, Ini 12 Manfaat Daun Seledri untuk Kesehatan","“Ada berbagai manfaat seledri untuk kesehatan. Mulai dari meningkatkan kesehatan jantung, mengontrol tekanan darah, hingga mendukung fungsi pencernaan.”",https://d1vbn70lmn1nqe.cloudfront.net/prod/wp-content/uploads/2022/06/30075319/Inilah-X-Manfaat-Daun-Seledri-untuk-Kesehatan.jpg.webp,"Halodoc, Jakarta – Seledri merupakan sayuran yang termasuk bagian famili Apiaceae, yaitu wortel. Sayuran ini memiliki tangkai yang renyah dan bisa dipilih sebagai camilan rendah kalori. Menariknya lagi, seledri juga memberikan berbagai manfaat kesehatan untuk tubuh. 
Berbagai manfaat yang berasal dari sayuran ini terjadi karena kandungan nutrisi yang sangat beragam di dalamnya. Untuk itu, tidak ada salahnya simak ulasan mengenai kandungan nutrisi serta manfaatnya untuk kesehatan!
Kandungan Nutrisi Seledri
Awalnya, seledri dikenal sebagai tanaman herbal yang bisa mengatasi beberapa jenis penyakit. Kini, sayuran ini menjadi salah satu bumbu masak yang bisa menambahkan cita rasa dan aroma yang lezat pada makanan tertentu.
Nah, kamu bisa memanfaatkan sayuran ini, mulai dari batang hingga daunnya. Batangnya kaya selulosa yang merupakan karbohidrat kompleks pada dinding sel tumbuhan. Kandungan tersebut aman untuk kamu konsumsi, tetapi sulit untuk dicerna.
Lalu, apakah sayuran ini layak untuk dikonsumsi? Meskipun begitu, seledri memiliki berbagai kandungan zat gizi mikro yang menjadikannya layak untuk dikonsumsi.
Berikut berbagai kandungan nutrisi dalam 40 gram seledri:
Kalori: 5,6.Lemak: 0,1 gram.Sodium: 32 gram.Karbohidrat: 1,2 gram.Serat: 0,6 gram.Gula: 0,5 gram.Protein: 0,3 gram.Potasium: 104 miligram.Sodium: 32 miligram.Fosfor: 9,6 miligram.Vitamin A: 8,8 mikrogram.Folat: 14,4 mikrogram.Vitamin K: 11,7 mikrogram.




Beragam Manfaat Seledri untuk Kesehatan
Nutrisi dalam seledri memiliki beragam manfaat kesehatan bagi tubuh. Namun, bagaimanapun, nutrisi tersebut hanya dalam jumlah yang relatif kecil.
Dengan kata lain, hanya mengonsumsi seledri saja tidak cukup untuk memenuhi gizi tubuh. Namun, setidaknya ini manfaat seledri bagi kesehatan:
1. Mendukung kesehatan jantung
Selain memiliki kandungan air yang tinggi, sayuran ini juga mengandung banyak vitamin dan mineral. Termasuk potasium dan kalsium, yang penting untuk kesehatan jantung. Di dalamnya juga mengandung folat dan vitamin K, keduanya diperlukan untuk pembentukan sel darah merah dan pembekuan darah yang efektif. 
Sayuran ini juga merupakan sumber senyawa tanaman pelindung yang disebut flavonoid, yang memiliki efek antiinflamasi dan perlindungan pada sistem kardiovaskular. Menjalani pola makan dengan sumber makanan berserat seperti seledri, bermanfaat untuk menurunkan risiko penyakit jantung.
Manfaat flavonoid pada seledri juga terdapat pada jurnal Phytotherapy Research (PTR) yang berjudul Beneficial effects of celery (Apium graveolens) on metabolic syndrome: A review of the existing evidences. Menurut penelitian tersebut, flavonoid dalam seledri mampu menekan risiko peradangan yang terjadi pada kardiovaskular.
Stres oksidatif dan peradangan pada aliran darah menjadi salah satu pemicu gangguan kesehatan jantung yang paling utama. 
2. Mendukung fungsi pencernaan
Sayuran ini merupakan sumber serat larut dan tidak larut yang baik, yang penting untuk fungsi pencernaan. Kandungan fitonutrien juga bermanfaat untuk melindungi mukosa pencernaan, dan mencegah tukak lambung.
3. Mengontrol tekanan darah
Beberapa praktisi pengobatan Cina, memanfaatkan ekstraknya untuk menurunkan tekanan darah. Studi dari PubMed Central melihat efek ekstrak bijinya pada tekanan darah tikus yang memiliki tekanan darah normal atau hipertensi buatan.
Peneliti pada studi tersebut menyimpulkan bahwa ekstraknya dapat mengurangi tekanan darah dan meningkatkan detak jantung pada tikus dengan tekanan darah tinggi. 
Namun, efek yang sama tidak terlihat pada tikus dengan tekanan darah normal. Karena itu, masih diperlukan banyak penelitian mengenai manfaatnya untuk membantu menurunkan tekanan darah pada manusia. 
Kamu bisa simak ulasan lengkap mengenai manfaat seledri untuk tekanan darah melalui artikel ini Seledri Ampuh Atasi Hipertensi, Ini Fakta Medisnya.
4. Seledri dapat meredakan hiperlipidemia
Hiperlipidemia mengacu pada peningkatan molekul lemak dalam darah. Kondisi ini sering kali tidak bergejala, tapi dapat meningkatkan risiko jangka panjang penyakit jantung dan stroke. 
5. Dapat meningkatkan kontrol gula darah
Dengan indeks glikemik yang rendah dan kandungan serat yang tinggi, sayuran ini bermanfaat bagi mereka yang perlu memantau kadar gula darahnya. Studi juga menunjukkan bahwa cara ini juga efektif untuk mengurangi kadar glukosa darah.
6. Mencegah kanker
Sayuran ini juga bisa membantu kamu untuk mencegah penyakit kanker. Seledri mengandung antioksidan yang sangat tinggi di dalamnya. 
Antioksidan membantu melindungi tubuh mencegah terjadinya stres oksidatif yang memicu pertumbuhan sel kanker.



7. Mencegah Alzheimer
Penelitian menunjukkan bahwa ekstrak bijinya mengandung L-3-n-butylphthalide yang dapat meningkatkan kemampuan kognitif dan memori. Kandungan ini bisa menurunkan risiko dan mencegah penyakit Alzheimer.
8. Seledri dapat menjaga kesehatan mata
Antioksidan dalam seledri mampu mencegah mata dari paparan radikal bebas yang bisa menyebabkan gangguan kesehatan mata. Kamu bisa menurunkan risiko gangguan, seperti pandangan buram, mata kering, hingga makula degenerasi.
9. Menurunkan berat badan
Sayuran ini mengandung serat dan air yang cukup tinggi. Selain itu, kalorinya juga terbilang cukup rendah. Hal ini membuat seledri menjadi salah satu sayuran yang bisa membantu kamu untuk menurunkan berat badan.
10. Mengoptimalkan perkembangan janin dalam kandungan
Bagi ibu hamil, cobalah untuk mengonsumsi sayuran ini. Kandungan folat di dalamnya membuat perkembangan dan pertumbuhan janin dalam kandungan menjadi lebih optimal. Selain itu, ibu akan terhindar dari berbagai komplikasi yang rentan terjadi selama kehamilan.
11. Meningkatkan kualitas sperma
Selain untuk ibu hamil, seledri juga bermanfaat untuk pria. Mengonsumsi sayuran ini bisa meningkatkan kualitas sperma. Hal ini terjadi karena kandungan antioksidannya yang cukup tinggi.
12. Mengoptimalkan kesehatan saraf
Sayuran ini mengandung apigenin yang sangat baik untuk pertumbuhan dan perkembangan saraf. Kandungan ini juga mampu berkontribusi bagi kesehatan neuron.
Itulah berbagai manfaat seledri yang perlu kamu ketahui. Kamu bisa mengonsumsi seledri dalam bentuk sayuran atau ekstrak. Namun, pastikan kamu mengonsumsinya dalam jumlah yang sesuai. 
Efek Samping Mengonsums Air Rebusan Seledri
Ada berbagai efek samping yang terjadi ketika kamu mengonsumsi air rebusan seledri berlebihan:
1. Alergi
Bagi sebagian besar, seledri merupakan makanan yang sehat. Namun, bagi beberapa orang lainnya mungkin memiliki alergi terhadap seledri. Reaksi ringan setelah mengonsumsi seledri mungkin bisa terjadi. Misalnya gejala gatal pada mulut dan lidah, bersin, atau pilek.
2. Gangguan ginjal
Penting juga untuk dicatat bahwa sayuran ini mengandung oksalat yang tinggi. Sehingga mungkin tidak cocok dikonsumsi bagi mereka yang memiliki batu ginjal, atau kondisi lainnya yang berhubungan dengan ginjal.
3. Perut kembung
Mengonsumsi air rebusannya secara berlebihan dapat menyebabkan perut kembung. Efek samping ini bisa terjadi akibat senyawa mannitol yang cukup tinggi sehingga memicu gangguan pencernaan.
Itulah efek samping yang mungkin terjadi. Mengonsumsi jus seledri berlebihan ternyata juga berisiko mengalami efek samping Meski Bermanfaat, Ketahui Efek Samping Jus Seledri.
Jangan lupa untuk segera lakukan pemeriksaan kesehatan agar keluhan kesehatan yang kamu alami bisa teratasi dengan baik. Gunakan layanan Halodoc Home Lab (tersedia di Jabodetabek dan Surabaya) untuk melakukan pemeriksaan secara praktis. Klik gambar berikut untuk memesannya: 

Referensi:
Medical News Today. Diakses pada 2022. Health benefits and risks of celery.
BBC Good Food. Diakses pada 2022. Top 5 health benefits of celery.
Live Science. Diakses pada 2022. Celery: Health benefits & nutrition facts.
Nourish by Web MD. Diakses pada 2023. Health Benefits of Celery.
Very Well Fit. Diakses pada 2023. Celery Nutrition Facts and Health Benefits.
Healthline. Diakses pada 2023. 5 Healthy Benefits of Adding Celery to Your Diet.
Pharmeasy. Diakses pada 2023. 8 Health Benefits Of Eating Celery.Phytotherapy Research (PTR). Diakses pada 2023. Beneficial effects of celery (Apium graveolens) on metabolic syndrome: A review of the existing evidences.",dr. Fadhli Rizal Makarim,30 Mei 2023,"[""kesehatan"",""makanan""]",https://www.halodoc.com/artikel/jarang-diketahui-ini-12-manfaat-daun-seledri-untuk-kesehatan,0,0
61c727ae-0044-11ee-bd96-bb155eb672e5,9 Obat Herbal yang Ampuh Atasi Sakit Lutut dan Sendi,"“Obat herbal dapat menjadi pilihan alternatif yang efektif dalam mengatasi sakit lutut dan sendi. Dengan sifat anti-inflamasi dan analgesik, obat herbal ini dapat membantu meredakan peradangan.""",https://d1vbn70lmn1nqe.cloudfront.net/prod/wp-content/uploads/2023/05/10041132/X-Obat-Herbal-yang-Ampuh-Atasi-Sakit-Lutut-dan-Sendi.jpg.webp,"Halodoc, Jakarta – Sakit lutut dan sendi adalah masalah kesehatan yang umum terjadi pada berbagai kalangan usia. Masalah ini memengaruhi kualitas hidup seseorang dan mengganggu aktivitas sehari-hari. Untuk mencegahnya, kamu juga bisa membaca artikel mengenai Ketahui Cara untuk Mencegah Terjadinya Masalah pada Sendi. 
Meskipun terdapat banyak obat-obatan kimia yang tersedia untuk mengatasi masalah ini. Namun, beberapa orang lebih memilih menggunakan obat herbal sebagai alternatif. Lantas, herbal apa saja yang bisa digunakan untuk atasi sakit lutut dan sendi? Simak penjelasannya!
Berbagai Obat Herbal untuk Atasi Sakit Lutut dan Sendi
Nah, berikut ini beberapa obat herbal yang membantu mengatasi sakit lutut dan sendi.
1. Kunyit
Kunyit adalah salah satu bahan herbal yang penggunaannya sering terdapat pada masakan dan obat-obatan tradisional. Bahan herbal ini mengandung senyawa kurkumin yang memiliki sifat antiinflamasi dan analgesik yang membantu mengurangi peradangan dan mengurangi rasa sakit pada lutut dan sendi.
2. Jahe
Jahe juga merupakan salah satu bahan herbal yang sering terdapat dalam masakan dan obat-obatan tradisional. Kandungan senyawa gingerol pada jahe memiliki sifat antiinflamasi dan analgesik yang membantu meredakan peradangan dan mengurangi rasa sakit pada lutut dan sendi.
3. Lidah Buaya
Lidah buaya mengandung senyawa anti-inflamasi yang dapat membantu meredakan peradangan pada lutut dan sendi. Selain itu, lidah buaya juga mengandung senyawa antioksidan untuk memperkuat sistem kekebalan tubuh dan mencegah kerusakan sel.
4. Daun Salam
Daun salam mengandung senyawa anti-inflamasi dan antioksidan yang dapat membantu meredakan peradangan dan mengurangi rasa sakit pada lutut dan sendi. Tanaman herbal ini mengandung senyawa eugenol yang memiliki sifat analgesik.
5. Temulawak
Temulawak adalah bahan herbal sebagai obat tradisional untuk mengatasi berbagai masalah kesehatan, termasuk sakit lutut dan sendi. Kandungan senyawa kurkumin yang terdapat pada temulawak, memiliki sifat anti-inflamasi dan analgesik yang dapat membantu mengurangi peradangan dan mengurangi rasa sakit pada lutut dan sendi.
6. Daun Sirsak
Daun sirsak mengandung senyawa antioksidan dan anti-inflamasi yang dapat membantu meredakan peradangan pada lutut dan sendi. Senyawa ini juga membantu memperkuat sistem kekebalan tubuh dan mencegah kerusakan sel.
7. Pegagan
Pegagan mengandung senyawa antioksidan dan anti-inflamasi yang dapat membantu meredakan peradangan pada lutut dan sendi. Senyawa ini juga membantu memperkuat sistem kekebalan tubuh dan meningkatkan produksi kolagen.
8. Boswellia
Boswellia atau kemenyan telah digunakan selama berabad-abad sebagai pengobatan tradisional. Ini memiliki sifat anti-inflamasi yang bermanfaat dalam mengatasi permasalahan pada radang sendi.
9. Kayu Putih
Eucalyptus adalah obat yang tersedia yang digunakan orang untuk berbagai kondisi. Ekstrak daun kayu putih berperan sebagai obat topikal untuk mengobati nyeri radang sendi. Daun tanaman mengandung tanin, yang membantu mengurangi pembengkakan dan rasa sakit yang berhubungan dengan radang sendi.
Itulah beberapa obat herbal yang dapat menjadi pilihan alternatif sebagai obat sakit lutut dan sendi. Jika penggunaan obat herbal tidak membuat permasalahan lutut dan sendi membaik, lakukan pemeriksaan pada dokter di rumah sakit terdekat.
Kamu bisa mengunjungi rumah sakit pilihan menggunakan Halodoc. Caranya download aplikasi Halodoc melalui App Store atau Google Play sekarang juga!

Referensi:
Healthline. Diakses pada 2023. 9 Herbs to Fight Arthritis Pain.
Medicines. Diakses pada 2023. Use of Herbal Medications for Treatment of Osteoarthritis and Rheumatoid Arthritis.",dr. Rizal Fadli,10 Mei 2023,"[""herbal"",""kesehatan"",""obat""]",https://www.halodoc.com/artikel/9-obat-herbal-yang-ampuh-atasi-sakit-lutut-dan-sendi,0,0
61dae8d1-0044-11ee-ac0f-bb155eb672e5,5 Gerakan Yoga yang Bisa Dilakukan oleh Pemula,,https://d1vbn70lmn1nqe.cloudfront.net/prod/wp-content/uploads/2021/12/03060103/5-Gerakan-Yoga-yang-Bisa-Dilakukan-oleh-Pemula-Halodoc.jpeg.webp,"“Yoga adalah olahraga yang terbilang cukup ringan, tetapi memberikan banyak manfaat untuk kesehatan. Olahraga satu ini juga cocok untuk dilakukan oleh siapa saja. Bagi kamu yang ingin mencoba olahraga satu ini, ada beberapa gerakan yoga yang cocok untuk dilakukan oleh pemula. Salah satunya adalah child pose.”
Halodoc, Jakarta – Rutin melakukan olahraga menjadi hal yang cukup penting dilakukan untuk menjaga kesehatan tubuh. Kamu bisa melakukan olahraga yang tergolong ringan tetapi dapat memberikan manfaat yang cukup banyak, salah satunya dengan olahraga yoga. Kegiatan ini merupakan olahraga olah tubuh dan pikiran yang fokus pada kekuatan, fleksibilitas, hingga pernapasan.
Tidak hanya untuk sarana relaksasi, olahraga yoga pun dapat bermanfaat untuk mengurangi penyakit kronis. Olahraga ini dapat dilakukan oleh siapa saja, termasuk pada anak-anak. Jangan ragu untuk mencoba dan memulai rutin melakukan yoga, karena banyak gerakan-gerakan yoga yang bisa dilakukan oleh pemula. Yuk, simak ulasannya, di sini.
Gerakan Yoga bagi Pemula
Olahraga yoga merupakan olahraga yang bisa dilakukan oleh siapa saja. Selain dapat membuat tubuh menjadi lebih rileks, berlatih yoga membuat kesehatan kamu akan semakin optimal. Namun, bagi para pemula, sebaiknya hindari gerakan-gerakan yang terlalu sulit karena dapat tingkatkan risiko cedera, apalagi jika kamu berlatih yoga tanpa dampingan seorang instruktur.
Untuk itu, sebaiknya ketahui beberapa gerakan yoga yang bisa dilakukan oleh pemula agar kamu dapat merasakan manfaat dari olahraga yoga.
1. Child Pose

Pose ini dianggap menjadi pose yang paling menenangkan. Kamu bisa menggunakan child pose untuk beristirahat setelah melakukan gerakan lain dari olahraga yoga. Pada saat melakukan child pose, kamu bisa mengembalikan fokus dan kembali mengatur pernapasan dengan baik. 
2. Downward-Facing Dog

Untuk melakukan gerakan ini, pertama letakkan kaki di atas matras dengan kuat. Kemudian, mulailah dengan gerakan seperti merangkak. Letakkan tangan dengan kuat di atas matras sebagai tempat bertumpu bahu dan kaki untuk menahan area pinggul. Tarik tubuh ke atas secara perlahan dan buatlah kaki dan punggung menjadi lurus. Pastikan kepala berada di antara tangan. Lakukan gerakan ini selama 5–10 tarikan napas.
3. Upward-Facing Dog

Mulailah dengan pose plank, yaitu meletakkan telapak tangan pada matras dengan tangan terbuka sejajar dengan bahu. Rentangkan kaki dan hadapkan tubuh menghadap matras. Kemudian, angkat tangan secara perlahan hingga bagian dada naik ke atas. Setelah tangan lurus, angkat kepala hingga ke arah depan.
4. Mountain Pose

Berdiri dengan kuat diatas matras dan tempatkan berat badan secara seimbang pada kedua kaki. Buatlah bahu menjadi lebih rileks dengan menggerakan bahu ke belakang dan bawah. Tarik napas dengan menaikkan tangan ke atas kemudian turunkan secara perlahan. 
5. Seated Forward Fold

Untuk melakukan gerakan ini, duduklah dengan rileks pada matras. Lebarkan kaki dan punggung yang tegak. Lakukan gerakan membungkuk secara perlahan, jika bisa, lakukan gerakan membungkuk hingga tangan kamu menyentuh kaki bagian luar atau tulang kering. Sebaiknya jangan paksakan dan lakukan sesuai dengan kemampuan tubuh. Lakukan gerakan ini hingga 5–10 tarikan napas.
Manfaat Yoga bagi Kesehatan
Bukan hanya membantumu menurunkan kondisi stres, rutin melakukan yoga juga dapat memberikan berbagai manfaat pada kesehatan, lho. Melakukan olahraga yoga dapat mengatasi gangguan kecemasan yang kamu alami. Hal ini disebabkan rutin melakukan yoga dapat membuat pikiran serta tubuh menjadi lebih tenang.
Tidak hanya meningkatkan kesehatan mental, olahraga yoga dapat menurunkan risiko peradangan pada tubuh. Tahukah kamu bahwa peradangan yang tidak diatasi dalam tubuh dapat menyebabkan berbagai penyakit, seperti gangguan jantung, diabetes, hingga kanker? Jadi, jangan ragu untuk memulai olahraga yoga.
Itulah beberapa manfaat yang bisa kamu rasakan dengan rutin menjalankan olahraga yoga. Jangan lupa lakukan yoga dengan baik dan pilihlah instruktur yang tepat. Hal ini dilakukan untuk menghindari cedera saat melakukan yoga. Segera gunakan aplikasi Halodoc dan bertanya langsung pada dokter untuk penanganan pertama pada kondisi cedera saat melakukan yoga. Kamu bisa download aplikasi Halodoc sekarang juga melalui App Store atau Google Play.

Referensi:
The New York Times. Diakses pada 2021. Yoga for Everyone.
Self. Diakses pada 2021. 12 Must Know Yoga Poses for Beginners.
Healthline. Diakses pada 2021. 13 Benefits of Yoga That Are Supported by Science.",dr. Rizal Fadli,03 Desember 2021,"[""olahraga"",""yoga"",""pemula""]",https://www.halodoc.com/artikel/5-gerakan-yoga-yang-bisa-dilakukan-oleh-pemula,0,0
