id,title,summary,imgUrl,content,author,createdAt,tags,link,viewers,likes
6b9b8f47-0044-11ee-9725-bb155eb672e5,"Anak Mudah Marah, Begini Tips Menghadapinya",,https://d1bpj0tv6vfxyp.cloudfront.net/articles/a7eb507e-a023-4da7-8404-4b10e26161e4_article_image_url.webp,"Halodoc, Jakarta - Tidak hanya orang dewasa, anak-anak juga bisa marah. Kondisi ini wajar terjadi, karena marah adalah reaksi untuk meluapkan kekesalan. Anak biasanya menunjukkan rasa kesal dengan menangis histeris, berteriak-teriak, mengamuk, dan menjadi lebih galak pada orang lain. Namun, marah tetap harus dikendalikan untuk menghindari perilaku agresif. 
Menghukum atau memarahi anak yang menunjukkan kemarahannya tidak tepat untuk dilakukan orangtua. Meski sangat menguji kesabaran dan membuat ibu dan ayah terkadang frustasi, orangtua harus berkepala dingin dalam menghadapi kemarahan anak, terlebih jika anak marah dan menunjukkannya di tempat umum. Malu sudah pasti, tetapi menghukum atau memarahinya tidak pernah meredakan amarahnya. 
Lalu, Bagaimana Cara Menghadapinya? 
Psikologis anak tidak sama, ada anak yang penurut, tetapi ada pula yang memiliki sifat mudah marah. Tidak dengan balas emosi atau memarahinya, ibu dan ayah bisa melakukan cara mudah berikut ini untuk meredakan sifat mudah marah pada sang buah hati. 

Cari Sebab Anak Marah

Ini hal pertama yang harus ibu lakukan ketika mendapati sang buah hati menjadi mudah marah. Mungkin ia lapar, mainannya rusak, sedang tidak enak badan, atau ada hal yang tidak sesuai dengan keinginan dan mengganggu kenyamanannya. Dengan mengetahui sebab anak marah, ibu bisa lebih mudah dalam mencari solusinya. 
Baca juga: Anak Mudah Marah di Sekolah, Benarkah Gejala dari ODD?

Ciptakan Komunikasi yang Dinamis

Komunikasi memang diperlukan untuk mengetahui bagaimana tumbuh kembang anak dan kondisi psikologis anak. Mulailah dengan menjadi pendengar yang baik, karena anak suka dengan perhatian. Dengarkan semua yang ia katakan, meski terkadang ibu kurang paham maksud perkataannya. 

Jadilah Panutan yang Baik

Lingkungan turut berperan dalam membentuk sikap dan sifat sang buah hati. Ini artinya, selalu berikan contoh yang baik pada anak. Apabila anak tumbuh dengan melihat orangtuanya kerap marah, emosi, bahkan hingga memukul, ia akan menjadi pribadi yang tidak jauh dari sifat dan sikap tersebut. 

Berikan Larangan yang Masuk Akal

Kata jangan dan tidak boleh yang sering ibu gunakan untuk melarang anak tanpa sadar akan membatasi ruang geraknya. Anak pun merasa kurang dipercaya untuk melakukan sesuatu oleh orangtuanya. Agar ia tidak menjadi pribadi yang minder dan kurang percaya diri, berikan penjelasan yang masuk akal mengapa ibu melarangnya berbuat sesuatu. Jadi, ia akan lebih mengerti mana benar dan mana yang kurang tepat. 
Baca juga: Mengenal 2 Jenis Tantrum pada Anak

Hindari Bacaan atau Tontonan yang Mengandung Unsur Kekerasan

Sebagai anak yang tumbuh di era yang serba canggih ini, sudah pasti ia akan sangat akrab dengan ponsel atau gawai. Secara tidak langsung, anak rentan terpapar konten-konten yang sarat akan unsur kekerasan, bisa dari film, permainan, atau video yang ia saksikan melalui gawai. Hindari terjadinya hal ini dengan memberikannya buku yang sesuai dengan usianya. 
Baca juga: Kenali Penyebab Murung pada Anak
Jika cara-cara tadi masih belum mengurangi sifat psikologis anak yang mudah marah, ibu bisa langsung bertanya pada ahlinya. Bertanya kapan saja dan di mana saja sekarang lebih mudah dengan adanya aplikasi Halodoc. Ibu cukup download dan pasang aplikasinya di ponsel, lalu bisa langsung bertanya pada psikolog anak. Ahli psikologi akan memberikan solusi terbaik untuk semua masalah ibu yang berhubungan dengan psikologis anak. 

Referensi: 
Verywell. Diakses pada 2019. 7 Ways to Help an Angry Child.
NHS UK. Diakses pada 2019. Dealing with Child Angry.
Empowering Parents. Diakses pada 2019. Angry Kids: 7 Things Not to Do when Your Child is Angry.",dr. Fadhli Rizal Makarim,14 Januari 2020,"[""marah"",""psikologi"",""anak""]",https://www.halodoc.com/artikel/anak-mudah-marah-begini-tips-menghadapinya,0,0
6bad8037-0044-11ee-b739-bb155eb672e5,"Anak Mudah Marah dan Tersinggung, Hati-Hati Gejala ODD",,https://d1bpj0tv6vfxyp.cloudfront.net/articles/e48c03b6-d735-4d34-8d42-a24181396b32_article_image_url.webp,"Halodoc, Jakarta – Kebanyakan anak-anak memang kadang-kadang sulit diatur dan cenderung suka melanggar peraturan. Perilaku tersebut mungkin saja hanyalah kenakalan anak-anak biasa. Namun, bila anak atau anak remaja ibu menunjukkan perilaku yang mudah marah, sering berdebat, menantang atau balas dendam terhadap orangtuanya atau orang dewasa lainnya, mungkin saja ia mengalami oppositional defiant disorder (ODD). Cari tahu gejala ODD lebih lanjut di sini.
Memahami ODD Pada Anak
Anak-anak yang mengalami ODD biasanya sering mengekspresikan penolakan terhadap sesuatu melalui perdebatan, ketidakpatuhan, ataupun menjawab balik ketika dinasehati. Bila gejala ODD tersebut sudah terlihat pada anak selama lebih dari enam bulan dan perilakunya sangat kontras dengan kebanyakan anak seusianya, dapat dipastikan bahwa Si Kecil mengidap gangguan penentangan oposisi atau ODD. Seorang anak dengan gangguan tersebut juga dapat menunjukkan perilaku kasar dan sering bertengkar dengan temannya hanya karena masalah sepele. Selain itu, ia juga akan berusaha melawan semua peraturan yang ada.
Tidak hanya sampai di situ, kebanyakan anak-anak dan remaja yang mengidap ODD pun memiliki masalah perilaku lainnya, seperti gangguan defisit perhatian, ketidakmampuan untuk belajar, gangguan suasana hati, hingga gangguan kecemasan. Pada beberapa anak, ODD dapat terus berkembang menjadi gangguan perilaku yang lebih serius atau disebut juga gangguan perilaku.
Sebagai orangtua, ibu tidak harus mengatasi gangguan pada anak tersebut sendirian. Mintalah bantuan pada ahli medis seperti dokter, ahli kesehatan mental profesional, dan pakar perkembangan anak juga untuk membantu mencari jalan keluar atas ODD yang dialami Si Kecil.
Perawatan untuk mengatasi perilaku ODD pada anak biasanya melibatkan keterampilan belajar untuk membantu membangun interaksi di dalam keluarga yang positif dan untuk mengelola perilaku yang bermasalah. Terapi tambahan dan juga obat-obatan mungkin juga diperlukan untuk mengobati gangguan yang berhubungan dengan masalah mental tersebut.
Baca Juga: 4 Gangguan Mental yang Terjadi Tanpa Disadari
Gejala ODD pada Anak
Kebanyakan orangtua kadang-kadang kesulitan untuk mengenali perbedaan antara anak yang memiliki sifat yang keras atau emosional dengan anak yang mengidap ODD. Walau begitu, perilaku menantang yang ditunjukkan Si Kecil pada tahap-tahap perkembangan tertentu sebenarnya adalah hal yang normal.
Gejala ODD pada anak umumnya dimulai pada usia pra-sekolah. ODD kadang-kadang juga dapat berkembang di usia yang lebih dewasa, tapi biasanya hampir selalu terjadi sebelum tahun-tahun awal remaja. Gangguan perilaku ini menyebabkan kerenggangan hubungan yang signifikan dengan keluarga, penurunan kegiatan sosial, sekolah, hingga pekerjaan.
Baca juga: Anak Idap ODD, Apa yang Harus Dilakukan?
Salah satu gejala dari ODD adalah gangguan emosional. Hal tersebut umumnya terjadi paling tidak selama enam bulan. Perilaku marah dan mudah tersinggung biasanya ditunjukkan dalam bentuk:


Sering kehilangan kesabaran dengan mudah.


Sangat sensitif dan mudah tersinggung oleh orang lain.


Sering marah dan kesal terhadap hal yang tidak jelas.


Gejala ODD pada anak yang menyangkut perilaku argumentatif dan menantang adalah:


Sering berdebat dengan orang dewasa atau orang yang berwenang.


Seringkali aktif menantang atau menolak untuk mematuhi permintaan atau aturan yang dibuat oleh orang dewasa.


Kerap dengan sengaja mengganggu atau membuat orang lain marah.


Sering menyalahkan orang lain atas kesalahan atau kelakuannya.


Gejala ODD pada anak dengan tipe balas dendam adalah:


Sering mendendam apabila seseorang membuat ia marah.


Kerap menunjukkan perilaku pendendam paling tidak dua kali dalam enam bulan terakhir.


Selain itu, gejala ODD pada anak yang terjadi dapat bervariasi tergantung pada tingkat keparahannya:


ODD ringan: Anak hanya menunjukkan gejala pada situasi tertentu saja, seperti di rumah, di sekolah, atau ketika bermain dengan teman-temannya.


ODD sedang: Anak menunjukkan gejala paling tidak di dua situasi yang berbeda.


ODD parah: Gejala terjadi pada tiga situasi atau lebih. Pada beberapa kasus, anak dengan ODD awalnya hanya menunjukkan gejala di rumah, tetapi lama-kelamaan lebih sering terjadi dan di beberapa situasi berbeda, seperti sekolah atau lingkungan sosial.


Baca juga: 5 Prosedur untuk Atasi Borderline Personality Disorder (BPD)
Itulah gejala ODD pada anak yang dapat terjadi. Jika kamu mempunyai pertanyaan perihal gangguan ini, dokter dari Halodoc siap membantu. Caranya mudah, yaitu dengan download aplikasi Halodoc di App Store atau Google Play.

Referensi:
Mayo Clinic. Diakses pada 2020. Oppositional defiant disorder (ODD).",dr. Rizal Fadli,31 Maret 2020,"[""marah"",""psikologi"",""anak""]",https://www.halodoc.com/artikel/anak-mudah-marah-dan-tersinggung-hati-hati-gejala-odd,0,0
6bbe880f-0044-11ee-905e-bb155eb672e5,Apakah Normal Balita yang Galak dan Sering Marah?,,https://d1bpj0tv6vfxyp.cloudfront.net/articles/353039_11-2-2021_16-33-45.webp,"Halodoc, Jakarta – Apakah balita sering marah sesuatu yang normal? Faktanya, kemarahan adalah emosi yang normal dan sehat jika diungkapkan dengan tepat. Namun, beberapa balita sering marah dan terkesan galak. Mereka bertengkar saat bermain game dan berdebat saat melakukan sesuatu yang menyenangkan. Ketidakmampuan untuk mengatasi emosi dapat memengaruhi kualitas hidup anak. Informasi selengkapnya mengenai balita yang sering marah bisa dibaca di sini!Baca juga: Keuntungan Menetapkan Pola Asuh AutoritatifBalita Sering Marah Bisa Karena Gangguan Kesehatan MentalJika balita sering marah dan mengalami kesulitan dalam mengungkapkan kemarahan dengan tepat atau kesulitan untuk mengelola emosi. Mungkin ini adalah tanda kalau anak memerlukan bantuan ahli kesehatan mental. Namun, sebelum membahas lebih jauh, perlu diketahui terlebih dahulu ada banyak faktor yang menyebabkan anak merasa marah atau mengungkapkan kemarahannya dengan menjadi galak. Perasaan yang belum terselesaikan, seperti kesedihan terkait perceraian atau kehilangan orang yang dicintai, bisa menjadi akar masalahnya. Riwayat trauma atau pernah mengalami penindasan dapat menyebabkan kemarahan juga.Masalah kesehatan mental juga mungkin terkait dengan ledakan amarah pada balita. Anak-anak dengan depresi, kecemasan, gangguan menantang oposisi, atau gangguan attention-deficit/ hyperactivity berjuang untuk mengatur emosi mereka.Berikut adalah tanda-tanda saat orangtua membutuhkan bantuan profesional untuk menangani emosi anak: 1. Kesulitan dengan HubunganMemukul saudara kandung atau memanggil nama seseorang sesekali adalah hal yang normal pada anak kecil. Namun, ketika amarah anak-anak menghalangi mereka untuk mempertahankan persahabatan, atau mengganggu pengembangan hubungan yang sehat dengan anggota keluarga, inilah saatnya untuk mengatasi masalah tersebut.Baca juga: Pola Asuh yang Bisa Mencegah Sindrom Peter Pan2. Mengganggu Aktivitas Sehari-hari Anggota Keluarga Jika aktivitas anggota keluarga terganggu karena perilaku anak, ini bisa memicu kondisi yang tidak sehat di keluarga. Jika keluarga lebih sering melewatkan kegiatan yang menyenangkan atau interaksi ibu dengan dengan anak yang lain jadi sering terganggu, perilaku anak yang demikian perlu segera ditangani. 3. AgresifKetika anak-anak berjuang untuk memecahkan masalah, menyelesaikan konflik dengan agresif, itu berarti anak membutuhkan penanganan untuk bisa mengelola emosinya. Terkadang, mengajarkan keterampilan baru dapat membantu anak belajar bahwa perilaku agresif tidaklah perlu.Baca juga: Si Kecil Suka Marah-Marah? Ini Tips Mengatasinya4. Perilaku “Tidak Dewasa”Meskipun normal bagi anak usia 2 tahun untuk menjatuhkan diri ke lantai dan menendang kaki mereka saat marah, itu bukanlah sesuatu yang harus dibiasakan. Jika amukan anak tampaknya semakin parah, itu pertanda bahwa mereka mengalami kesulitan untuk mengatur emosinya.5. Frustrasi yang SeringSaat anak-anak dewasa, mereka harus mengembangkan kemampuan untuk mentolerir aktivitas yang membuat frustrasi. Jika orangtua melihat anak lebih sering mengalami frustasi sehingga marah-marah tak jelas, ini adalah tanda kalau anak membutuhkan bantuan khusus.Kalau orangtua ingin mendapatkan informasi mengenai gangguan perilaku pada balita, bisa ditanyakan melalui Halodoc. Butuh obat tapi tidak punya waktu ke apotek? Sekarang membeli obat bisa dilakukan melalui Halodoc. Tanpa perlu keluar rumah, tinggal tentukan sendiri pilihan obat sesuai kebutuhan.Berinteraksilah dengan anak mengenai cara mengelola emosi dapat membantu mereka mengekspresikan perasaan mereka. Biarkan mereka tahu bahwa orangtua memahami bahwa mereka kesal atau frustrasi, dan tidak masalah untuk memiliki perasaan ini.Penting juga untuk menahan dorongan untuk mendisiplinkan balita yang pemarah. Hal ini dapat meningkatkan perilaku agresif dan dapat membuatnya lebih frustrasi. Tetapkan batasan dengan berbicara kepada anak tentang situasinya. Cobalah bawa anak bercanda, tetapi jangan pernah singgung mengenai beban yang orangtua rasakan karena mengurus anak. Ibu bisa memulainya dengan membuat wajah atau suara konyol, atau lakukan hal lain yang orangtua tahu anak akan suka.Referensi:Healthline. Diakses pada 2021. Help! Why Is My Toddler Angry and What Can I Do to Help Them?Very Well Family. Diakses pada 2021. 5 Signs Your Child Needs Help Managing Anger.",dr. Verury Verona Handayani,15 Februari 2021,"[""marah"",""psikologi"",""anak""]",https://www.halodoc.com/artikel/apakah-normal-balita-yang-galak-dan-sering-marah,0,0
6bcedbec-0044-11ee-bddd-bb155eb672e5,"Anak Lebih Sering Marah selama Pandemi, Apa Penyebabnya?",,https://d1vbn70lmn1nqe.cloudfront.net/prod/wp-content/uploads/2021/07/22051538/Anak-Lebih-Sering-Marah-selama-Pandemi-Apa-Penyebabnya_.jpg.webp,"“Jika merasa sering cemas atau bosan setahun belakangan ini, hal tersebut dapat dimengerti karena ibu tidak sendirian. Energi negatif tersebut juga sedang dirasakan oleh manusia di belahan dunia manapun, tidak terkecuali anak-anak. Jika anak mengalaminya, salah satu cara mengungkapkannya adalah dengan marah-marah.”
Halodoc, Jakarta – Pandemi virus corona sangat memengaruhi perilaku dan kesehatan banyak orang dari segi fisik dan mental, tidak terkecuali anak-anak. Hal tersebut diduga akibat frekuensi pertemuan dengan orangtua yang semakin sering, sehingga anak menjadi lebih manja, bahkan suka sekali marah-marah. Sebenarnya, apa yang menjadi penyebab anak sering marah selama masa pandemi berlangsung? Kemudian, bagaimana cara mengatasi emosi pada anak tersebut?
Baca juga: Ketahui Cara Penyimpanan Tabung Oksigen di Rumah
Ini yang Jadi Penyebab Anak Sering Marah Selama Pandemi
Anak-anak cenderung mudah sekali marah saat pandemi virus corona seperti sekarang ini. Penyebabnya sendiri adalah, dunia mereka yang terbalik. Di usia anak-anak mereka seharusnya pergi bersekolah atau ke playground untuk sekedar bertemu teman atau bermain. Mereka juga bisa marah akibat orangtua yang berada di depan mata, tetapi tidak meluangkan banyak waktu untuk anak.
Memang kondisi seperti sekarang ini bukan sepenuhnya kesalahan orangtua, tetapi anak-anak tidak mengerti terkait kewajiban-kewajiban yang harus dilakukan orangtua saat berada di rumah saja. Waktu tidak bisa dilakukan sepenuhnya untuk menemani anak bermain, karena mungkin orangtua harus bekerja di rumah dan melakukan pekerjaan rumah lainnya.
Terkait dengan anak yang seringkali marah, orangtua disarankan untuk berhubungan baik dengan emosi anak. Ibu bisa mempelajari apa penyebab anak sering marah. Apakah ia merasa khawatir, sakit hati, takut, sedih, kehilangan, atau kebingungan. Pasalnya, anak-anak cenderung kurang bisa menginterpretasikan emosinya dengan baik tanpa bantuan orangtua.
Baca juga: Wajib Tahu, Ini Efek Vaksin COVID-19 Terhadap Siklus Menstruasi
Cara Mengatasi Emosi pada Anak yang Sering Meledak
Guna mengatasi emosi pada anak dan meredakan amarahnya, ibu sebaiknya memberi pilihan yang cocok bagi mereka untuk menyalurkan emosi anak yang terpendam. Jika orang dewasa melakukan olahraga, menulis, yoga, menonton film, atau mendengarkan musik, anak-anak biasanya lebih membutuhkan orangtua sebagai penyalut emosinya. Berikut ini beberapa hal yang dapat ibu lakukan bersama untuk mengatasi emosi pada anak:
1. Melakukan Kegiatan yang Menyenangkan
Langkah pertama yang dapat dilakukan untuk mengatasi emosi pada anak adalah dengan melakukan aktivitas atau kegiatan menyenangkan. Berikut ini beberapa hal tersebut:
Menari-nari dengan tarian konyol sembari mendengarkan musik.Berolahraga sembari bermain.Menghentakkan kaki atau baris-berbaris di tempat.Bermain dengan tanah liat atau adonan yang bisa dibentuk.Melukis bersama.Bermain petak umpet atau lari-larian.Mencoret-coret di secarik kertas sembari meluangkan amarah dengan berteriak.
2. Mendalami Perasaan Anak
Langkah selanjutnya dalam mengatasi emosi pada anak adalah mendalami perasaannya. Langkah yang satu ini dapat dilakukan dengan berbicara empat mata tentang apa yang mereka rasakan. Orangtua perlu bertanya kepada anak, terkait hal-hal yang membuatnya marah. Jika jawabannya adalah bosan karena tidak bisa bermain bebas layaknya dengan teman. Ibu bisa melakukan poin pertama. Mengabaikan perasaan anak bukanlah cara yang sehat untuk menghadapi emosinya.
3. Bantu Anak Mengungkapkan yang Dirasakan
Pada beberapa kasus, penyebab anak sering marah adalah karena ia belum menemukan kata-kata yang tepat untuk mengungkapkan perasaannya. Berkaitan dengan hal tersebut, ibu harus membantu anak mengungkapkan apa yang dirasakan dengan kata-kata dan kalimat sederhana. Kata-kata dan kalimat tersebut yang nantinya dapat meluapkan kemarahan, sehingga ibu pun mudah mengerti apa yang dirasakan anak.
4. Berikan Contoh yang Baik
Meski tidak marah secara gamblang, anak tahu kapan ibu atau ayah berkelahi. Jika dibiarkan terus-menerus, hal tersebut dapat menjadi emosi negatif anak, yang bisa saja dicontoh kemudian hari. Jika saat ribut tidak sengaja terlihat oleh anak, jelaskan kepada mereka mengapa pertengkaran tersebut terjadi. Tentunya dengan bahasa yang sederhana. Setelah itu, berilah contoh yang baik, karena anak adalah sebaik-baiknya pencontoh.
Baca juga: Cara Menyusui untuk Ibu Pengidap COVID-19
Setelah mengetahui penyebab anak sering marah tersebut, diharapkan ibu dapat melakukan beberapa upaya untuk mengatasi emosi pada anak yang sering meluap. Selain menjaga kesehatan mental anak dengan sejumlah langkah tersebut, ibu disarankan untuk memenuhi asupan gizi dan nutrisi yang diperlukan dengan mengonsumsi suplemen atau multivitamin tambahan. Untuk membelinya, ibu bisa menggunakan fitur “toko kesehatan” di aplikasi Halodoc, ya.

Referensi:
PennState Extension. Diakses pada 2021. I’m So Mad! Helping Children Deal With Anger During the Pandemic.
Child Mind. Diakses pada 2021. Coronavirus Parenting: Managing Anger and Frustration.
UNICEF. Diakses pada 2021. Is my child regressing due to the COVID-19 pandemic?",dr. Rizal Fadli,22 Juli 2021,"[""marah"",""psikologi"",""anak""]",https://www.halodoc.com/artikel/anak-lebih-sering-marah-selama-pandemi-apa-penyebabnya,0,0
6be019bb-0044-11ee-89bf-bb155eb672e5,"Si Kecil Sering Marah, Ini Cara Mengatasinya",,https://d1bpj0tv6vfxyp.cloudfront.net/articles/81676683-f1bb-4222-9f7c-50476deb19d6_article_image_url.webp,"Halodoc, Jakarta - Ketika anak marah, hal tersebut wajar terjadi sebagai salah satu bentuk meluapkan emosi yang dirasakan. Namun, jika mereka marah dengan mengamuk, menjerit, atau memukul, hal ini wajib dipertanyakan. Meskipun tampak normal jika terjadi pada Si Kecil, kemarahan yang tidak terkontrol akan memicu timbulnya perilaku agresif di kemudian hari.
Baca juga: Si Kecil Suka Marah-Marah? Ini 5 Tips Mengatasinya
Apakah Si Kecil sering mengalaminya? Jika iya, sebaiknya ibu jangan langsung berbalik marah, membentak, atau bahkan menghukumnya. Ibu perlu mengenali lebih dalam apa yang menjadi penyebab perilaku agresif pada Si Kecil. Berikut ini langkah-langkah yang dapat ibu lakukan untuk mengatasi Si Kecil yang sering marah:

Menenangkan

Jika Si Kecil bersifat agresif dengan marah atau memukul saat sedang bermain, ibu dapat memanggilnya dan mengajaknya ke tempat tenang, kemudian tanyakan penyebabnya. Katakan pada mereka, marah tidak mengapa, asal jangan menyakiti orang lain.

Dengarkan Mereka

Sering kali orangtua mengabaikan mereka karena sibuk dengan ponselnya. Ketika hal ini terus-menerus terjadi, Si Kecil akan merasa tidak penting, sehingga marah adalah bentuk mereka dalam mencari perhatian orangtua.

Komunikasi

Orangtua yang sering menyempatkan waktu untuk berkomunikasi dengan Si Kecil dan melakukan sesi tukar pendapat akan membuat Si Kecil merasa aman dan nyaman. Ibu dapat membangun komunikasi sejak dini, agar orangtua mengerti apa yang dirasakan dan diinginkan Si Kecil.
Baca juga: Anak Mudah Marah di Sekolah, Benarkah Gejala dari ODD?

Peluk Mereka

Anak yang pemarah merupakan anak yang membutuhkan perhatian lebih kedua orangtuanya. Mereka akan mencari perhatian dengan cara yang salah. Dalam hal ini, ibu dapat memeluknya dan mengatakan bahwa ibu sangat sayang dengan mereka. Katakan pada mereka bahwa mereka harus jadi anak yang baik dan membanggakan.

Contoh yang Baik

Orangtua memang akan selalu menjadi contoh bagi anak-anaknya. Oleh karena itu, orangtua harus selalu menunjukkan kebaikan di setiap gerak-geriknya. Tak hanya perilaku, berikan juga ucapan-ucapan baik untuk anak.

Jangan Memukul Anak

rewel memang terkadang menjadi sasaran empuk orangtuanya. Bagi yang tidak sabar, mereka akan memukul anak sebagai hukuman. Dalam hal ini, sebaiknya orangtua dapat memberikan pengertian yang tegas agar selalu diingat.

Jangan Membandingkannya

Ketika bingung, terkadang orangtua akan membandingkan anak dengan saudara kandung atau anak-anak lain. Meski maksudnya baik, anak belum dapat berpikir demikian. Mereka akan merasa minder, tak berharga dan tersisih. 

Pantau Mereka

Dalam hal ini, ibu dapat selalu memantau anak saat sedang menonton televisi. Jangan biarkan mereka menonton film atau acara yang menunjukkan kekerasan fisik atau verbal. Mereka akan merekam segala sesuatu dalam otaknya. Bisa saja hal ini dapat memengaruhinya di kemudian hari. Pesan bagi para ibu, selektif dalam memilih acara televisi.
Baca juga: Tips Menghadapi Anak yang Sedang Ngambek
Mendidik, mengajarkan dan mengarahkan anak memang bukan perkara mudah. Banyak hal yang harus orangtua pelajari. Dalam menghadapi sikap temperamen anak, sebaiknya orangtua memperhatikan atau mencari apa yang menjadi pemicunya. Dengan mengetahui penyebabnya, orangtua dapat lebih mudah mencari solusi.
Anak dengan temperamen tinggi memang sangat menguji kesabaran dalam menghadapinya. Wajar saja banyak orangtua yang ikut tersulut emosinya. Alih-alih menenangkan, banyak orangtua justru melakukan kesalahan dengan balik memarahi atau menghukumnya. Jika sejumlah tips tersebut tidak dapat mengatasi Si Kecil dengan kemarahannya, ibu dapat langsung bertanya dengan dokter ahli di aplikasi Halodoc mengenai hal ini.

Referensi:
Empowering Parents. Diakses pada 2019. Angry Child Outbursts: 10 Essential Rules for Dealing with an Angry Child.
Very Well Family. Diakses pada 2019. 7 Ways to Help an Angry Child.",dr. Verury Verona Handayani,10 Desember 2019,"[""marah"",""psikologi"",""anak""]",https://www.halodoc.com/artikel/si-kecil-sering-marah-ini-cara-mengatasinya,0,0
