id,title,summary,imgUrl,content,author,createdAt,tags,link,viewers,likes
6870fc19-0044-11ee-a10f-bb155eb672e5,4 Manfaat Support System buat Kesehatan Mental,“Ada beberapa manfaat dari memiliki support system bagi kesehatan mental. Salah satunya adalah memberikan dukungan sosial kepada seseorang di masa-masa sulit.”,https://d1vbn70lmn1nqe.cloudfront.net/prod/wp-content/uploads/2022/10/19041820/X-Manfaat-Support-System-buat-Kesehatan-Mental.jpg.webp,"Halodoc, Jakarta – Saat ini istilah support system mungkin lazim terdengar atau kerap diperbincangkan banyak orang. Apalagi ketika masa-masa sulit, seperti pandemi COVID-19 mulai berlangsung. Nah, support system sendiri diartikan sebagai seseorang atau lebih yang mampu memberikan kekuatan dan dukungan sosial. Baik secara emosional maupun secara langsung, melalui tindakan positif tertentu. 
Menariknya lagi, memiliki support system diyakini dapat bermanfaat baik pada kesehatan mental seseorang. Namun, kira-kira apa saja manfaat support system bagi kesehatan mental? Yuk, ketahui penjelasannya di sini! 
Ketahui dulu Perbedaannya
Perlu diketahui bahwa support system terbagi dalam beberapa jenis yang memiliki fungsi berbeda, yaitu: 
Dukungan emosional. Sistem pendukung ini dapat membantu seseorang saat butuh ditemani, khususnya ketika sedang terpuruk, kesepian, atau sedih. Dukungan instrumental. Dalam kasus lain, seseorang mungkin akan memberikan dukungan yang bersifat instrumental. Contohnya seperti menawarkan bantuan, atau menawarkan sesuatu yang berkaitan dengan kebutuhan fisik, seperti mengirimi makanan. Dukungan informasi. Orang juga dapat memberikan apa yang dikenal sebagai dukungan informasi. Ini dapat melibatkan pemberian bimbingan, saran, informasi, dan pendampingan. 
Manfaat Support System untuk Kesehatan Mental
Berikut adalah beberapa manfaat dari memiliki sistem dukungan bagi kesehatan mental: 
1. Memberikan dukungan sosial 
Manfaat pertama yang dapat diperoleh dari hal ini adalah support system seperti teman atau keluarga dapat memberikan dukungan sosial. Apalagi di masa-masa sulit seperti ketika pandemi, atau ketika seseorang baru kehilangan anggota keluarganya. Sebab, masa sulit, terutama yang membuat seseorang larut dalam kesedihan, berpotensi menyebabkan seseorang untuk mengisolasi dirinya. Padahal, isolasi justru malah dapat memperburuk keadaan mental seseorang. 
2. Membantu seseorang mengatasi stres
Perlu diingat bahwa stres terbukti dapat memicu berbagai dampak negatif pada tubuh. Mulai dari penurunan kekebalan tubuh, sampai peningkatan risiko penyakit jantung yang tidak dapat disepelekan. Nah, adanya dukungan sosial dari orang terdekat juga dapat membantu seseorang untuk mengatasi stres. Sebab, dikelilingi oleh orang-orang yang peduli dan suportif dapat membantu seseorang melihat dirinya lebih mampu menghadapi tekanan yang ada di hidupnya. 
Selain itu, penelitian juga menunjukkan bahwa memiliki dukungan yang kuat saat krisis, dapat membantu seseorang mengurangi konsekuensi dari gangguan akibat trauma. Salah satunya seperti post traumatic stress disorder atau PTSD. 
3. Meningkatkan motivasi 
Manfaat selanjutnya dari memiliki support system adalah mampu meningkatkan motivasi seseorang. Sebab, hubungan sosial dapat membantu seseorang untuk tetap termotivasi ketika sedang berusaha mencapai tujuan mereka. Sebagai contoh, seseorang yang sedang berusaha berhenti merokok, membutuhkan dukungan secara emosional.
Ketika orang tersebut diberikan dukungan sosial oleh teman-temannya yang juga ingin berhenti merokok, maka dirinya akan semakin termotivasi untuk benar-benar meraihnya. Selain itu, berbicara dengan support system khususnya yang memiliki pengalaman atau tujuan sama, juga dapat menjadi sumber empati dan dukungan. 
4. Meningkatkan rasa kepercayaan diri
Tak hanya memberikan dukungan, mengatasi stres, atau meningkatkan motivasi, adanya support system juga mampu meningkatkan rasa kepercayaan diri seseorang. Sebab, ketika seseorang memiliki teman atau keluarga yang selalu ada untuknya, ada gelombang emosi positif yang terpancar. 
Emosi positif tersebut tentunya membuat seseorang merasa baik, merasa disayangi, dan merasa penting, bagi orang-orang terdekat yang selalu menyayanginya. Hal ini pada akhirnya dapat meningkatkan rasa kepercayaan diri seseorang, terutama mereka yang tengah merasa terpuruk atau sedih. 
Itulah beberapa manfaat dari support system untuk kesehatan mental. Jika kamu masih memiliki pertanyaan seputar support system atau sedang merasa terpuruk, segeralah hubungi psikolog. Melalui aplikasi Halodoc, kamu bisa tanya psikolog tepercaya untuk mendapatkan informasi yang dibutuhkan. Tentunya melalui fitur chat/video call secara langsung pada aplikasinya. Jadi, tunggu apa lagi? Yuk, download Halodoc sekarang juga!
Referensi: 
Verywell Mind. Diakses pada 2022. How a Social Support System Contributes to Psychological Health. 
American Psychological Association. Diakses pada 2022. Relations among social support, PTSD symptoms, and substance use in veterans. 
Suara. Diakses pada 2022. Support System Artinya Apa? Inilah Kenapa Kamu Membutuhkannya. 
Health Shots. Diakses pada 2022. Having a strong support system won’t make you feel weak. Here’s why.",dr. Rizal Fadli,19 Oktober 2022,"[""kesehatan mental"",""hubungan""]",https://www.halodoc.com/artikel/4-manfaat-support-system-buat-kesehatan-mental,0,0
6881aa32-0044-11ee-b997-bb155eb672e5,"Perlu Tahu, Ini Dampak Gagap pada Kesehatan Mental","“Gagap dapat menyebabkan gangguan kesehatan mental pada pengidapnya. Seperti misalnya, gangguan cemas hingga stres.”",https://d1vbn70lmn1nqe.cloudfront.net/prod/wp-content/uploads/2022/10/17064711/Perlu-Tahu-Ini-Dampak-Gagap-pada-Kesehatan-Mental.jpg.webp,"Halodoc, Jakarta – Gagap adalah kondisi yang menyebabkan gangguan pada seseorang ketika berkomunikasi. Biasanya, orang yang gagap tahu apa yang ingin ia sampaikan, tetapi ia kesulitan untuk mengatakannya secara jelas. Ada beberapa tanda yang menjadi gejala gagap, salah satunya adalah pengulangan kata.
Kondisi ini sering dialami oleh anak-anak yang masih belajar berkomunikasi dengan lancar. Namun, jika kondisi ini tidak membaik seiring perkembangan usia, sebaiknya lakukan pemeriksaan untuk mencegah komplikasi pada kesehatan mental yang dapat dialami akibat kondisi ini.
Dampak Gagap pada Kesehatan Mental
Hingga saat ini belum diketahui secara pasti apa penyebab gagap. Namun, adanya gangguan pada otak, saraf, dan otot yang berkaitan dengan kemampuan bicara seseorang bisa menjadi penyebab kondisi ini. 
Selain itu, gagap juga bisa disebabkan oleh faktor genetik sehingga bisa diturunkan dalam keluarga. Kondisi ini juga rentan dialami ketika seseorang mengalami tekanan sosial sehingga pengidapnya merasa gugup dan tidak rileks.
Jika tidak diatasi, kondisi ini dapat menyebabkan gangguan pada kesehatan mental, seperti:
Gangguan Cemas
Gangguan kecemasan adalah masalah yang kerap dialami oleh seseorang yang mengalami gagap. Apalagi saat berbicara di ruang publik, kondisi ini dapat menyebabkan pengidapnya mengalami rasa cemas dan takut yang dapat memperburuk kondisi.
Jika kondisi ini terjadi secara berulang, bukan tidak mungkin seseorang dapat mengalami gangguan cemas yang semakin memburuk.
Kehilangan Rasa Percaya Diri
Gagap dapat menyebabkan seseorang mengalami penurunan hingga kehilangan rasa percaya diri untuk berbicara dengan orang lain. Kondisi ini membuat orang lain akan kesulitan menangkap maksud dan tujuan dari pembicaraan yang dilakukan.
Jika kamu mengalami kondisi ini, kamu bisa menyiapkan catatan kecil sebelum berbicara dengan orang lain. Jadi, tidak ada salahnya sesekali membaca catatan yang kamu buat agar komunikasi yang dilakukan bisa mencapai tujuannya.
Stres
Gagap bisa menyebabkan seseorang mengalami stres. Saat kondisi ini berlangsung, gagap bisa menjadi lebih buruk.
Itulah berbagai gangguan kesehatan mental yang bisa terjadi akibat gagap. Tidak ada salahnya kamu melakukan pemeriksaan di rumah sakit terdekat untuk memastikan kondisi kesehatan yang kamu alami. Caranya download aplikasi Halodoc melalui App Store atau Google Play sekarang juga.
Kenali Gejala Gagap
Gagap bisa muncul saat anak berusia 18-24 bulan. Nah, ada beberapa tanda yang dikenali sebagai gejala gagap, seperti:
Kesulitan untuk memulai sebuah kata atau kalimat.Memperpanjang kata atau suara.Pengulangan suara atau kata.Ada jeda diantara kata atau kalimat saat berbicara.Gerakan wajah atau tubuh yang berlebihan saat berbicara.
Gejala ini biasanya juga akan disertai dengan tanda pada fisik, seperti:
Berkeringat.Mengedipkan mata secara berlebihan.Tremor pada area mulut dan bibir.
Itulah beberapa gejala yang akan dialami oleh seseorang saat mengalami kondisi gagap. Pada anak-anak, hal ini dapat membaik seiring perkembangan usia, tetapi ibu perlu mengetahui beberapa tanda yang memerlukan penanganan tim medis, seperti:
Tidak membaik saat anak mengalami pertambahan usia.Gagap dirasakan semakin memburuk.Kemampuan berbicara anak tidak meningkat.Memengaruhi aktivitas anak di sekolah dan lingkungan.Menyebabkan kecemasan sosial pada anak.
Segera lakukan pemeriksaan kesehatan anak pada psikolog atau dokter anak. Mengetahui kondisi ini lebih dini membuat pengobatan lebih mudah dilakukan. Yuk, cari tahu rumah sakit terdekat menggunakan Halodoc. Caranya download aplikasi Halodoc melalui App Store atau Google Play.
Referensi:
START. Diakses pada 2022. Why Mental Health Should Be a Focus for People Who Stutter.
Mayo Clinic. Diakses pada 2022. Stuttering.
Healthline. Diakses pada 2022. Stuttering.",dr. Fadhli Rizal Makarim,17 Oktober 2022,"[""kesehatan mental""]",https://www.halodoc.com/artikel/perlu-tahu-ini-dampak-gagap-pada-kesehatan-mental,0,0
68924519-0044-11ee-a0a5-bb155eb672e5,Ketahui 5 Manfaat Meditasi untuk Kesehatan Mental,"“Stres dan kesibukan sehari-hari dapat membuat kamu kehilangan fokus. Untungnya, meditasi bisa membantu kamu mendapatkan kembali fokus dan kesadaran diri.”",https://d1vbn70lmn1nqe.cloudfront.net/prod/wp-content/uploads/2022/10/14090452/Ketahui-X-Manfaat-Meditasi-untuk-Kesehatan-Mental.jpg.webp,"Halodoc, Jakarta –   Meditasi menjadi bagian penting untuk kesehatan mental karena dapat memberikan perasaan tenang, damai, dan seimbang. Oleh karena itu, meditasi bisa membawa manfaat bagi kesejahteraan emosional dan kesehatan secara keseluruhan. 




Meditasi juga dapat mengatasi stres dengan memfokuskan kembali perhatian pada sesuatu yang menenangkan. Orang yang menjalani meditasi dapat lebih terfokus dan damai secara batin. Nah, informasi lengkap mengenai manfaat meditasi untuk kesehatan mental bisa dibaca di sini!
Manfaat Meditasi untuk Kesehatan Mental
Manfaat meditasi untuk kesehatan mental sangat banyak, seperti dapat meningkatkan fokus dan konsentrasi. Stres dan kesibukan sehari-hari dapat membuat kita kehilangan fokus, dan meditasi bisa mengembalikan fokus dan kesadaran diri.
Nah, berikut ini manfaat meditasi untuk kesehatan mental?
1. Meningkatkan Harga Diri dan Awareness
Meditasi memungkinkan kamu untuk melakukan refleksi diri yang lebih dalam, sehingga membantu menemukan atribut positif tentang diri sendiri. Meditasi juga membantu meningkatkan kesadaran diri sendiri dan empati kepada orang lain. 
Ketika meditasi membangun empati, maka kamu bisa menemukan perspektif baru terkait suatu masalah. Ini akan mengurangi kecemasan sosial yang biasanya timbul ketika sedang diperhadapkan pada suatu situasi.
2. Mengelola Kecemasan dan Depresi
Meditasi membantu melatih pikiran untuk fokus pada situasi sekarang sehingga kamu tidak akan  berfokus pada kecemasan akan peristiwa yang belum terjadi. 
Pada akhirnya, meditasi yang penuh perhatian dapat membantu meredakan kecemasan dan depresi, sehingga dapat menjadi bagian dari rencana perawatan kesehatan mental yang komprehensif.
Terkait dengan manfaatnya meredakan kecemasan, meditasi juga membantu masalah kesulitan tidur, kehilangan nafsu makan, dan suasana hati yang buruk. 
3. Melawan Kecanduan
Meditasi dapat mengubah reseptor otak yang terkait dengan kecanduan obat dan alkohol, sehingga dapat mengurangi keinginan untuk konsumsi zat-zat ini.  Meditasi dapat meningkatkan kesadaran sehingga memungkinkan kamu untuk mengelola dorongan “kecanduan” lebih baik lagi. 
Melatih kesadaran dapat membantu mencegah kekambuhan di masa depan bagi orang-orang dengan gangguan penggunaan zat. Ini karena meditasi bisa menghasilkan efek terapeutik yang membantu mengatur otak saat merasakan kesenangan.
4. Meningkatkan Kesehatan Emosional
Beberapa bentuk meditasi dapat meningkatkan citra diri dan pandangan hidup yang lebih positif.  Meditasi ini bisa membantu mengurangi pikiran negatif dan mengontrol respon berlebih untuk situasi yang negatif.
5. Menjaga Kesehatan Fungsi Memori
Stres dapat menurunkan fungsi memori. Nah, bermeditasi dapat meningkatkan kejernihan berpikir dan menjaga fungsi memori. Meditasi juga membantu mengendalikan stres dan mendukung mereka yang merawat anggota keluarga dengan demensia.
Mengenal Jenis-Jenis Meditasi
Meditasi adalah istilah umum aktivitas yang dilakukan untuk mendapatkan relaksasi. Ada banyak jenis meditasi dan teknik relaksasi yang memiliki komponen meditasi dan semuanya memiliki tujuan sama untuk mencapai kedamaian batin. 
Berikut beberapa jenis meditasi:
1. Meditasi yang Dipandu
Metode meditasi yang dipandu dapat membentuk gambaran mental tentang tempat atau situasi di mana kamu bisa merasa santai dan tenang. Biasanya, meditasi yang dipandu ini akan mengajak kamu ataupun peserta meditasi lain untuk menggunakan indra seperti bau, pemandangan, suara, dan tekstur. 
2. Meditasi dengan Mantra
Pada meditasi ini, kamu akan diam dan mengulangi kata atau kalimat dengan kekuatan penuh dan pikiran fokus. Ini dilakukan untuk memberikan efek menenangkan dan mencegah pikiran terganggu.
3. Qigong
Latihan ini umumnya menggabungkan meditasi, relaksasi, gerakan fisik dan latihan pernapasan untuk mengembalikan dan menjaga keseimbangan. Qi gong juga dikenal sebagai bagian dari pengobatan tradisional China.
4. Tai Chi
Ini adalah bentuk latihan seni bela diri China yang lembut. Dalam tai chi, kamu akan diminta melakukan serangkaian postur atau gerakan mandiri dengan cara yang lambat dan anggun sambil berlatih pernapasan dalam.
5. Yoga
Merupakan jenis latihan dengan melakukan serangkaian postur dan latihan pernapasan terkontrol untuk meningkatkan tubuh yang lebih fleksibel dan pikiran yang tenang. Saat kamu bergerak melalui pose yang membutuhkan keseimbangan dan konsentrasi, kamu didorong untuk fokus pada momen dan pose. 
Dari informasi ini bisa disimpulkan bahwa meditasi memang bermanfaat untuk kesehatan mental. Namun, jika kamu masih punya banyak pertanyaan seputar kesehatan mental, tanyakan langsung ke psikolog lewat aplikasi Halodoc. Yuk, download aplikasi Halodoc sekarang juga!
Referensi:
Healthline. Diakses pada 2022. 12 Science-Based Benefits of Meditation.
World Economic Forum. Diakses pada 2022. Many business leaders meditate. It might be because it can help you make fewer mistakes.
Insider.com. Diakses pada 2022. 7 benefits of meditation, and how it can affect your brain.
EveryDay Health. Diakses pada 2022. How Meditation Can Improve Your Mental Health.
Healthline. Diakses pada 2022. How Meditation Can Improve Your Mental Health.",dr. Fadhli Rizal Makarim,14 Oktober 2022,"[""kesehatan mental"",""meditasi""]",https://www.halodoc.com/artikel/ketahui-5-manfaat-meditasi-untuk-kesehatan-mental,0,0
68a2e0e6-0044-11ee-b48e-bb155eb672e5,Dampak Perceraian pada Kesehatan Mental Anak,"“Perceraian kedua orang tua bisa menimbulkan dampak berupa masalah kesehatan mental pada anak. Beberapa di antaranya depresi, penarikan diri dari lingkup sosial dan kecemasan.”",https://d1vbn70lmn1nqe.cloudfront.net/prod/wp-content/uploads/2022/10/12055219/Dampak-Perceraian-pada-Kesehatan-Mental-Anak.jpg.webp,"Halodoc, Jakarta – Perceraian menjadi langkah terakhir ketika sepasang suami istri tidak menemukan titik penyelesaian masalah. Keadaan ini biasanya terjadi akibat kurangnya komunikasi dan ketidakcocokan karakter.



Tak hanya itu, perceraian terjadi ketika salah satu pasangan berselingkuh dan mengkhianati komitmen yang mereka buat. Masalah semakin rumit ketika pasangan sudah memiliki anak dari hasil pernikahannya.




Saat memutuskan bercerai dan mengasuh anak seorang diri, anak berisiko kehilangan salah satu karakter orang tuanya. Dampaknya, mereka berisiko terkena gangguan kesehatan mental, salah satunya kecemasan.
Masalah Kesehatan Mental Anak Akibat Perceraian
1. Merasa Emosi
Perceraian orang tua bisa mengubah dunia anak dalam waktu singkat. Jika tadinya memiliki keluarga lengkap dan tinggal satu atap, momen itu tidak akan pernah lagi dirasakan olehnya. Proses ini menimbulkan perasaan emosi.
Emosi yang dialami dikaitkan dengan perasaan marah akibat ditinggalkan oleh salah satu orang tua. Tak jarang anak jadi kehilangan kendali. Mereka juga bisa menyalahkan diri sendiri atas perceraian kedua orang tuanya.
Dari rasa marah ini, anak bisa saja berubah menjadi lebih agresif. Kondisi ini ditandai dengan perubahan temperamen dengan emosi meledak-ledak. Anak juga bisa saja memukul atau melempar barang saat emosi.
2. Menarik Diri dari Pergaulan
Perceraian menjadi beban mental tersendiri bagi anak. Kondisi ini bisa dipicu oleh rasa malu berlebihan akibat kondisi keluarga yang tidak lengkap. Akibatnya, anak memiliki citra diri yang rendah.
Mereka akan membandingkan diri dengan teman-temannya. Dengan sendirinya, anak merasa tersisih dari lingkungan dan mulai menarik dan menutup diri. Mereka bahkan bisa saja gugup ketika berhadapan dengan orang banyak.
3. Kecemasan Berlebihan
Perceraian orang tua menjadi salah satu kondisi yang menimbulkan rasa cemas berlebihan pada anak-anak. Kondisi ini bisa meninggalkan luka dalam batin yang bisa terus terbawa hingga dewasa.
Kecemasan berlebihan yang dialami oleh anak akibat perceraian orang tua ditandai dengan rasa percaya diri yang rendah. Mereka juga cenderung merasa ketakutan dan khawatir berlebihan ketika melakukan aktivitas yang berhubungan dengan orang tua. Salah satunya seperti mengambil rapot.
4. Stres Berlebihan
Pikiran kacau akibat perpisahan orang tua berdampak pada peningkatan hormon stres dalam tubuh. Mereka cenderung mengalami penurunan fokus, suka menyendiri dan perubahan pola tidur serta makan. Dampaknya, mereka bisa penurunan nilai akademik di sekolah. 
5. Depresi
Depresi merupakan perburukan kondisi dari stres. Kondisi ini ditandai dengan selalu menyendiri, menjauhi teman-temannya, mudah marah dan sering menangis. Anak juga cenderung kesulitan berkonsentrasi di sekolah.
Yang lebih memprihatinkan, beberapa anak juga berupaya bunuh diri. Kondisi ini cenderung dialami oleh anak-anak berusia di atas 11 tahun. Menurut American Academy of Pediatrics, anak laki-laki lebih berisiko memiliki pikiran untuk bunuh diri ketimbang anak perempuan.
Dalam jangka panjang, perceraian orang tua bisa berdampak pada cara anak memandang hidup, terutama soal pasangan. Perceraian orang tua di masa lalu bisa berdampak pada keengganan anak untuk menikah.
Ketika anak mengalami beberapa kondisi di atas, silakan buat janji rumah sakit untuk melakukan sesi konsultasi dengan psikolog atau psikiater. Cara ini dilakukan guna mencegah perburukan gejala dan penurunan kualitas hidup.
Jika membutuhkan informasi lain seputar kesehatan mental, gaya hidup dan pola anak, silakan download Halodoc sekarang juga.
Referensi:
Very Well Family. Diakses pada 2022. The Psychological Effects of Divorce on Children.
Healthline. Diakses pada 2022. 10 Effects of Divorce on Children — and Helping Them Cope.",dr. Rizal Fadli,12 Oktober 2022,"[""kesehatan mental"",""anak"",""hubungan""]",https://www.halodoc.com/artikel/dampak-perceraian-pada-kesehatan-mental-anak,0,0
68b246f0-0044-11ee-b104-bb155eb672e5,Ini Manfaat Menulis Jurnal Harian untuk Kesehatan Mental,"“Ada banyak manfaat menulis jurnal harian, terutama bagi mental. Kebiasaan ini juga dapat membantu penyembuhan depresi.”",https://d1vbn70lmn1nqe.cloudfront.net/prod/wp-content/uploads/2022/10/11072058/Ini-Manfaat-Menulis-Jurnal-Harian-untuk-Kesehatan-Mental.jpg.webp,"Halodoc, Jakarta – Manfaat menulis jurnal harian untuk kesehatan mental nyatanya sangat banyak. Kegiatan yang disebut journaling ini adalah tindakan menyimpan catatan pikiran, perasaan, wawasan pribadi, dan banyak lagi. Bisa ditulis, digambar, atau diketik. 
Menulis jurnal harian adalah cara sederhana untuk meningkatkan kesehatan mental. Meski tidak mudah untuk menulis setiap hari, efek positif dari journaling bisa dirasakan meski tidak dilakukan setiap hari. 
Manfaat Menulis Jurnal Harian
Ada banyak manfaat yang bisa didapat dari menulis jurnal harian, terutama bagi kesehatan mental, yaitu:
1. Bisa Mengurangi Kecemasan
Menulis jurnal tentang perasaan dapat membantu menurunkan tekanan mental yang dialami. Dalam sebuah penelitian pada 2018 yang diterbitkan di jurnal JMIR Mental Health, para peneliti meminta 70 orang dewasa dengan berbagai kondisi medis dan kecemasan untuk menulis selama 15 menit, tiga hari seminggu selama 12 minggu. 
Hasilnya, para peserta mengalami peningkatan perasaan sejahtera dan lebih sedikit gejala depresi setelah satu bulan. Kesejahteraan mental mereka terus meningkat selama 12 minggu menuis jurnal.
2. Membantu dengan Merenung
Ketika stres atau termakan oleh pikiran negatif, sulit untuk melihat situasi secara objektif. Menulis dalam jurnal dapat membantu kamu menciptakan ruang dan jarak yang diperlukan untuk merenungkan apa yang telah terjadi, di mana kamu berada, dan apa yang akan terjadi selanjutnya.
3. Menciptakan Kesadaran
Manfaat lainnya dari menulis jurnal harian adalah menciptakan kesadaran. Menuliskan perasaan tentang situasi yang sulit dapat membantu kamu memahaminya dengan lebih baik. Tindakan menempatkan pengalaman ke dalam kata-kata dan struktur memungkinkan kamu untuk membentuk persepsi baru tentang peristiwa tersebut.
4. Mengatur Emosi
Menulis jurnal harian juga memiliki manfaat untuk mengatur emosi. Dengan menuliskan apa yang dirasakan, kamu lebih mampu mengendalikan emosi dengan baik. 
5. Mendorong Keterbukaan
Menulis secara pribadi tentang peristiwa yang membuat stres dapat mendorong beberapa orang untuk mencari dukungan sosial. Ini dapat membantu penyembuhan emosional dan masalah kesehatan mental yang mungkin dialami.
6. Membantu Penyembuhan Masalah Kesehatan Mental
Menulis jurnal dapat membantu penyembuhan berbagai masalah kesehatan mental, seperti depresi, gangguan stres pasca trauma (PTSD) dan gangguan kecemasan. 
Tips Journaling untuk Pemula
Setelah mengetahui berbagai manfaat menulis jurnal harian bagi kesehatan mental, berikut ini tips menulis yang mungkin bermanfaat:
Pilih waktu yang paling cocok untuk menulis jurnal. Menetapkan waktu yang teratur sangat membantu, tetapi terimalah bahwa mungkin perlu untuk bersikap fleksibel.Mulailah dengan mengungkapkan perasaan. Beri waktu bagi diri sendiri untuk menyebutkan masing-masing perasaan. Kemudian lanjutkan untuk mengamati pikiran dan pola berpikir apa pun.Mulai dari yang kecil. Mulailah dengan menulis hanya beberapa menit tentang topik pilihan kamu. Misalnya peristiwa hari itu atau sesuatu yang mengganggu kamu.Ciptakan dan ekspresikan apa yang kamu inginkan dari kehidupan dan apa yang kamu rasakan. Tidak ada aturan, dan tidak ada cara yang salah untuk melakukan ini.Jangan khawatir tentang ejaan dan tanda baca. Tidak ada seorang pun yang akan menghakimi kamu.Pilih media yang cocok untuk kamu. Bisa di kertas, menggunakan komputer, atau merekam pikiran kamu yang diucapkan.Terimalah bahwa terkadang kamu tidak mood menulis, dan tidak apa-apa. Istirahatlah jika perlu. 
Itulah pembahasan mengenai manfaat menulis jurnal bagi kesehatan mental dan tips menulis yang bisa diterapkan. Jika kamu membutuhkan penanganan lebih lanjut dari ahlinya, download Halodoc saja untuk membuat janji medis dengan psikolog atau psikiater.
Referensi:
JMIR Mental Health. Diakses pada 2022. Online Positive Affect Journaling in the Improvement of Mental Distress and Well-Being in General Medical Patients With Elevated Anxiety Symptoms: A Preliminary Randomized Controlled Trial.
Positive Psychology. Diakses pada 2022. 5 Benefits of Journaling for Mental Health.
Psych Central. Diakses pada 2022. The Mental Health Benefits of Journaling.
WebMD. Diakses pada 2022. Mental Health Benefits of Journaling.",dr. Rizal Fadli,11 Oktober 2022,"[""kesehatan mental"",""hobi""]",https://www.halodoc.com/artikel/ini-manfaat-menulis-jurnal-harian-untuk-kesehatan-mental,0,0
