id,title,summary,imgUrl,content,author,createdAt,tags,link,viewers,likes
64e20ac5-0044-11ee-a4c5-bb155eb672e5,"Bukan Hanya Stres, Ini 4 Dampak Lembur bagi Kesehatan Mental","“Bekerja hingga waktu lembur mungkin sudah menjadi hal biasa bagi beberapa orang. Meski begitu, jangan sekali-kali menyepelekan dampak dari bekerja lembur, karena bisa menyebabkan masalah pada kesehatan mental.”",https://d1vbn70lmn1nqe.cloudfront.net/prod/wp-content/uploads/2023/05/04044909/Bukan-Hanya-Stres-Ini-X-Dampak-Lembur-bagi-Kesehatan-Mental.jpg.webp,"Halodoc, Jakarta – Bagi masyarakat perkotaan lembur atau bekerja di luar jam kerja, sepertinya sudah menjadi hal biasa. Walaupun sudah menjadi hal umum, nyatanya dampak lembur terus menerus dapat mempengaruhi baik kesehatan fisik maupun mental.
Nah, pertanyaannya, apa saja sih dampak lembur bagi kesehatan mental yang perlu diwaspadai?
Berbagai Dampak Lembur Bagi Kesehatan Mental
Tak cuma menguras energi secara fisik, terus-terusan bekerja lembur juga bisa menimbulkan pelbagai masalah pada psikis. Mau tahu apa saja?
1. Depresi
Depresi merupakan salah satu dampak lembur yang kerap kali dirasakan oleh banyak karyawan. Menurut sebuah jurnal yang dipublikasikan oleh The New England Journal of Medicine berjudul Work Hours and Depression in U.S. First-Year Physicians, semakin bertambahnya jam kerja seseorang setiap minggu, semakin besar juga kemungkinan mereka terserang depresi.
Terutama bagi orang yang memiliki pekerjaan dengan banyak tekanan seperti perawat, dokter, atau akuntan. Selain itu, wanita juga lebih rentan mengalami depresi akibat jam kerja yang panjang.
Sebab, sering kali mereka memiliki tugas ganda yang harus dikerjakan. Contohnya mengerjakan pekerjaan utama dan mengerjakan tugas rumah tangga serta merawat anggota keluarga.



2. Kecanduan alkohol
Selain depresi, dampak lembur selanjutnya adalah kecanduan alkohol. Mungkin beberapa orang masih belum tahu bahwa kecanduan alkohol juga termasuk dalam penyakit mental yang disebut dengan alkoholisme. 
Kecanduan alkohol terjadi karena ketika seseorang bekerja terlalu lama, mereka membutuhkan kegiatan lain untuk menenangkan pikiran. Nah, akhirnya mereka pun memilih minum alkohol.
Bekerja lebih dari 40 jam per minggu dapat berpotensi mendorong seseorang untuk minum alkohol dalam jumlah yang “berisiko”. Untuk wanita jumlah ini minimal 14 minuman per minggu, sedangkan untuk pria 21 minuman perminggu. Tentunya kecanduan alkohol selain berdampak buruk bagi kesehatan mental, juga berdampak buruk bagi kesehatan fisik.
3. Kualitas tidur yang buruk
Kurang tidur atau kualitas tidur yang buruk memang tidak termasuk ke dalam gangguan mental. Namun, kondisi ini dapat mempengaruhi kesehatan mental seperti stress, cepat marah, dan kurang fokus. 
Apabila kamu melakukan pekerjaan terus menerus, akan sangat sulit untuk mengistirahatkan pikiranmu. Bahkan, beberapa orang pun merasa tidak nyenyak saat tertidur karena banyaknya pekerjaan.  
Karena itu, kamu bisa menerapkan tips sederhana yaitu bekerja selama 52 menit dan istirahat selama 17 menit. Saat istirahat kamu bisa menggunakan waktu ini untuk berjalan-jalan sebentar, mengobrol dengan teman, atau melakukan peregangan. Ini mungkin dapat membantu mengatasi rasa kantuk saat bekerja.
Untuk mengetahui masalah kesehatan mental lainnya akibat kurang tidur, silahkan kunjungi laman berikut, “5 Masalah Mental Penyebab Susah Tidur Menurut Psikologi.”
4. Gangguan kecemasan
Gangguan kecemasan juga menjadi salah satu dampak lembur lainnya yang dirasakan oleh banyak pekerja.  Tanda-tanda seseorang mengalami gangguan kecemasan di tempat kerja, antara lain:
Menghindari rekan kerja, teman, atau keluarga.Kekhawatiran terus-menerus.Mengalami kesulitan berkonsentrasi atau mengingat sesuatu.Kehilangan minat pada pekerjaan.
Memiliki gangguan kecemasan saat bekerja dapat berdampak besar pada karir seseorang. Hal ini bisa mempengaruhi kinerja dan produktivitas yang buruk. Maka dari itu, jika kamu memiliki tanda-tanda kecemasan, segera hubungi psikolog agar mendapatkan penanganan segera.  
Bagaimana Cara Meminimalisir Kerja Lembur?
Setiap pekerja pasti pernah merasakan lembur. Sebenarnya wajar saja apabila bekerja hingga waktu lembur. Akan tetapi, dengan catatan tidak kamu lakukan terus-menerus. 
Tujuannya agar kesehatan fisik dan mental tetap terjaga. Nah, untuk meminimalisir kerja lembur kamu bisa menerapkan tips berikut ini:
Pisahkan antara kehidupan pribadi dan pekerjaan.Usahakan mengetahui prioritas tugas yang kamu kerjakan. Jika perlu, buatlah jadwal agar pekerjaan lebih terorganisir.Jangan meng-iya-kan semua pekerjaan. Lembur sering kali terjadi karena seseorang selalu menerima pekerjaan yang ditawarkan. Terkadang tidak apa-apa untuk menolak pekerjaan tertentu, dan memprioritaskan pekerjaan utama.Manfaatkan waktu istirahat sebaik mungkin.Matikan notifikasi yang tidak penting saat bekerja, agar kamu tetap bisa fokus.Luangkan waktu untuk diri sendiri.
Itulah beberapa dampak lembur bagi kesehatan mental. Ingatlah bahwa memberikan performa yang terbaik saat bekerja memang penting, tetapi menjaga kesehatan diri sendiri juga tidak kalah pentingnya. 
Nah, apabila kamu membutuhkan konsultasi mengenai masalah kesehatan mental, kamu bisa hubungi psikolog atau psikiater melalui aplikasi Halodoc.
Dengan Halodoc kamu bisa berkonsultasi dengan dokter terpercaya, cukup melalui smartphone tanpa perlu pergi ke rumah sakit. Praktis bukan? Yuk, tunggu apa lagi download Halodoc sekarang. 

Referensi:
Healthline. Diakses pada 2023. 7 Red Flags You’re Working Too Much
WebMD. Diakses pada 2023. How to Deal With Anxiety at Work
Cleveland Clinic. Diakses pada 2023. 5 Side Effects of Working Too Much
Nivati.com. Diakses pada 2023. Overworking: The Effects on Mental Health.",dr. Rizal Fadli,04 Mei 2023,"[""kesehatan mental""]",https://www.halodoc.com/artikel/bukan-hanya-stres-ini-4-dampak-lembur-bagi-kesehatan-mental,0,0
64f43b6f-0044-11ee-9d1f-bb155eb672e5,Bahaya Flexing bagi Kesehatan Mental yang Kerap Diabaikan,“Flexing dapat memiliki dampak yang signifikan pada kesehatan mental. Terus-menerus membandingkan diri dengan orang lain dan merasa tidak cukup baik dapat menyebabkan beberapa kondisi yang mengkhawatirkan.”,https://d1vbn70lmn1nqe.cloudfront.net/prod/wp-content/uploads/2023/04/25064818/Bahaya-Flexing-bagi-Kesehatan-Mental-yang-Kerap-Diabaikan.jpg.webp,"Halodoc, Jakarta – Flexing adalah istilah yang terpakai untuk menggambarkan tindakan memamerkan kekayaan, prestasi, atau kemampuan seseorang di media sosial. 
Banyak orang menganggap flexing sebagai cara untuk menunjukkan pencapaian mereka dan menarik perhatian orang lain. Namun, flexing yang berlebihan dapat berdampak negatif pada kesehatan mental seseorang.
Untuk menyikapi dengan baik, kamu juga dapat membaca artikel mengenai Tren Flexing di Media Sosial, Ini 5 Cara Bijak Menyikapinya.
Bahaya Flexing yang Harus Diwaspadai
Berikut adalah beberapa bahaya dari flexing bagi kesehatan mental:
1. Membuat Kamu Merasa Tidak Cukup
Flexing dapat memicu perasaan tidak aman dan merasa kurang dari orang lain. Saat melihat postingan seseorang yang terus-menerus memamerkan prestasi dan keberhasilan, kamu mungkin merasa tidak cukup baik dalam hal apapun yang kamu lakukan. Ini dapat menyebabkan perasaan sedih, rendah diri, dan stres.
2. Memperparah Kecemasan Sosial
Flexing juga dapat memperburuk kecemasan sosial. Kamu mungkin merasa tekanan untuk memposting tentang pencapaian atau memperlihatkan kekayaan agar bisa mendapatkan perhatian dan persetujuan dari orang lain. Hal ini dapat menyebabkan rasa cemas yang berlebihan dan bahkan mendorong untuk melakukan hal-hal yang tidak sehat seperti mengejar popularitas atau menghabiskan uang yang sebenarnya bukan milik sendiri.
3. Meningkatkan Risiko Depresi
Melakukan flexing secara terus-menerus dapat meningkatkan risiko depresi. Perasaan tidak cukup dan kecemasan sosial akibat flexing dapat membuat kamu merasa terisolasi dan kesepian. Selain itu, terlalu sering membandingkan diri dengan orang lain juga dapat memicu perasaan tidak berharga dan merasa tidak berguna.
4. Menyebabkan Ketidakbahagiaan
Flexing dapat membuat kamu merasa bahagia sejenak, tetapi pada akhirnya, hal itu dapat menyebabkan ketidakbahagiaan. Terus-menerus membandingkan diri dengan orang lain dan merasa tidak cukup baik dapat memperburuk suasana hati kamu dan membuat kamu merasa tidak puas dengan hidup yang dipunya.
5. Mengganggu Produktivitas dan Konsentrasi
Flexing juga dapat mengganggu produktivitas dan konsentrasi. Terus-menerus memeriksa media sosial untuk melihat postingan orang lain dapat memakan waktu dan mengganggu fokus kamu. Hal ini dapat menyebabkan keterlambatan dalam menyelesaikan tugas dan bahkan dapat mengganggu kinerja di tempat kerja atau di sekolah.
Cara Menghadapi Orang yang Flexing
Kadangkala, kita mengalami kesulitan jika harus menghadapi orang yang flexing. Karenanya, berikut merupakan cara untuk menghadapi orang flexing:
Buat orang tersebut paham akan tipe kamu yang berkebalikan dengan makna flexing.Ceritakan sedikit kebanggaan diri, kemudian koreksi diri.Bagikan cerita singkat tentang orang lain yang melakukan flexing dan menyombongkan diri.Komunikasikan kebenaran yang terjadi sepengetahuan kamu.Pergi meninggalkan jika kamu merasa percakapan tidak memiliki manfaat untuk diri sendiri.
Apabila sikap flexing sudah menjadi kebiasaan, maka dapat menimbulkan bahaya terutama bagi kesehatan mental. Jika kamu merasakan hal tersebut, kamu dapat berkonsultasi dengan psikologi atau dokter kesehatan jiwa melalui aplikasi Halodoc. Melalui Halodoc, kamu dapat mengonsultasikannya melalui chat maupun voice/video call. Jadi tunggu apalagi, yuk download Halodoc sekarang juga!

Referensi:
Insider. Diakses pada 2023. ‘Flexing’ or bragging about your expensive things may stop you from making friends, research shows.
Psychology Today. Diakses pada 2023. 5 Ways to Deal with Someone Who Never Stops Bragging.
Wired. Diakses pada 2023. The Psychological Impact of Seeing YouTubers Spend Millions.",dr. Rizal Fadli,25 April 2023,"[""kesehatan mental""]",https://www.halodoc.com/artikel/bahaya-flexing-bagi-kesehatan-mental-yang-kerap-diabaikan-3,0,0
6504f151-0044-11ee-a503-bb155eb672e5,Ketahui Manfaat Self-Talk untuk Menjaga Kesehatan Mental,"""Berbicara sendiri atau self-talk adalah hal yang lumrah dilakukan. Ternyata, self-talk juga bisa mengarahkanmu untuk mengambil keputusan yang tepat dalam hidup.""",https://d1vbn70lmn1nqe.cloudfront.net/prod/wp-content/uploads/2021/07/07062230/Ketahui-Manfaat-Self-Talk-untuk-Menjaga-Kesehatan-Mental-1.jpg.webp,"Halodoc, Jakarta – Pernahkah kamu berbicara kepada diri sendiri atau melakukan self-talk? Hal ini sebenarnya bukanlah hal yang aneh untuk dilakukan, bahkan hal ini dinilai bermanfaat untuk menjaga kesehatan mental.
Namun, kegiatan bicara dengan diri sendiri ini harus dilakukan dengan cara yang positif. Sebab, self-talk bisa memengaruhi bagaimana kamu menanggapi peristiwa dalam hidup. 
Self-talk adalah hal yang alami untuk dilakukan sepanjang hari. Banyak juga orang yang menjadi lebih sadar bahwa self-talk positif merupakan alat yang ampuh untuk meningkatkan kepercayaan diri, dan mampu mengendalikan emosi negatif. Orang yang bisa menguasai self-talk positif dianggap lebih percaya diri, termotivasi, dan produktif.
Benarkah Self-Talk Positif Bermanfaat?
Setiap orang selalu memiliki suara batin di kepala mereka sendiri yang bekerja seperti narasi. Sama seperti narasi yang berlangsung dalam drama atau film, kisah hidup kamu akan memiliki suara batin dari diri sendiri.
Suara batin ini terus memberitahu untuk menimbang pro dan kontra, menyampaikan kata-kata yang benar saat berbicara dan sering mendorong tubuh untuk bertindak.
Oleh karena itu, bicara dengan diri sendiri yang positif sangat bermanfaat. Ingatlah, kamu tidak dapat menjalani kehidupan yang positif dengan pikiran yang negatif.
Jadi, karena semua orang juga berperan sebagai narator kecil untuk dirinya sendiri, maka penting untuk memastikan bahwa itu adalah narator yang positif. Kamu perlu membuat suara internal ini menjadi suara yang positif untuk membantu kamu agar dapat membuat keputusan yang lebih baik dalam hidup.
Self-talk yang keluar ini merupakan kombinasi dari pikiran sadar dan bawah sadar di otak, persepsi umum tentang dunia dan kepercayaan secara umum, yang menghuni pikiran dan memengaruhi pembicaraan di dalam diri. 
Manfaat Self-Talk bagi Kesehatan Fisik dan Mental
Self-talk dapat meningkatkan kinerja dan kesejahteraan secara umum. Misalnya, penelitian menunjukkan self-talk dapat membantu atlet meningkatkan kemampuannya. Self-talk juga membantu mereka memiliki daya tahan atau kekuatan yang lebih baik. 
Self-talk yang positif dan pandangan yang lebih optimis dapat memiliki manfaat kesehatan lainnya, termasuk:
Vitalitas meningkat.Kepuasan hidup yang lebih besar.Meningkatkan fungsi kekebalan tubuh.Mengurangi rasa sakit atau nyeri.Kesehatan kardiovaskular yang lebih baik.Kesehatan fisik yang lebih baik.Pengurangan risiko kematian.Lebih sedikit stres dan kegelisahan.
Sampai kini, tidak jelas mengapa orang yang optimis dan individu dengan self-talk yang lebih positif mengalami manfaat ini. Namun, penelitian menunjukkan orang dengan self-talk positif mungkin memiliki keterampilan mental yang memungkinkan mereka untuk memecahkan masalah dan lebih efisien dalam mengatasi kesulitan atau tantangan. Hal ini dapat mengurangi efek berbahaya dari stres dan kecemasan.
Bagaimana Cara Melakukan Self-Talk Positif?
Sebelum kamu belajar untuk lebih banyak berbicara dengan diri sendiri, kamu harus terlebih dahulu mengidentifikasi pemikiran negatif. Jenis pemikiran dan self-talk ini umumnya jatuh ke dalam empat kategori:
Personalisasi. Kamu kerap menyalahkan diri sendiri untuk semua hal buruk yang terjadi.Membesar-besarkan. Kamu hanya fokus pada aspek negatif dari suatu situasi, mengabaikan setiap dan semua hal positif.Bencana. Kamu malah mengharapkan yang terburuk, dan kamu jarang membiarkan logika atau perasaan optimis bekerja.Polarisasi. Kamu hanya melihat dunia dalam hitam dan putih, atau baik dan buruk. Tidak ada di antara dan tidak ada jalan tengah untuk memproses dan mengkategorikan peristiwa kehidupan.
Ketika kamu mulai mengenali jenis pemikiran negatif, maka kamu dapat bekerja untuk mengubahnya menjadi pemikiran positif. Tugas ini membutuhkan latihan dan waktu serta tidak berkembang dalam semalam. Kabar baiknya, hal tersebut bisa kamu lakukan sendiri jika terus melatihnya.
Jika mau mencoba teknik self-talk positif, kamu bisa meminta saran juga pada psikolog di Halodoc. Psikolog juga mungkin punya saran yang bisa kamu lakukan untuk tetap memiliki self-talk yang baik. Tunggu apa lagi, manfaatkan aplikasi Halodoc untuk berbicara dengan psikolog, kapan dan di mana saja!

Referensi:
Calm Sage. Diakses pada 2023. Mental Health Benefits Of Positive Self Talk.
Healthline. Diakses pada 2023. What Are the Benefits of Self-Talk?
Healthline. Diakses pada 2023. Positive Self-Talk: How Talking to Yourself Is a Good Thing.",dr. Fadhli Rizal Makarim,04 April 2023,"[""kesehatan mental""]",https://www.halodoc.com/artikel/ketahui-manfaat-self-talk-untuk-menjaga-kesehatan-mental,0,0
6515dc3a-0044-11ee-9803-bb155eb672e5,5 Dampak Negatif FOMO bagi Kesehatan Mental,"“FOMO merupakan kondisi seseorang yang khawatir dan takut kehilangan pengalaman sosial atau kehidupan yang dinikmati orang lain. Jika tidak dikontrol, FOMO dapat berdampak negatif bagi kesehatan.”",https://d1vbn70lmn1nqe.cloudfront.net/prod/wp-content/uploads/2023/03/16043209/X-Dampak-Negatif-FOMO-bagi-Kesehatan-Mental-1.jpg.webp,"Halodoc, Jakarta – FOMO atau Fear of Missing Out adalah kondisi saat seseorang merasa khawatir dan takut melewatkan pengalaman sosial atau kehidupan orang lain. FOMO termasuk fenomena yang semakin meningkat dalam masyarakat modern yang serba terhubung secara digital. 
FOMO bermula dengan perilaku sering melihat gambar – gambar indah di media sosial dan merasa tertinggal atau merasa cemas ketika tidak dapat terlibat dalam pengalaman tersebut. Untuk mengenal lebih jauh mengenai FOMO, kamu dapat membaca artikel mengenai Mengenal Fenomena FOMO, Benarkah Picu Gangguan Mental?
Dampak Negatif FOMO Bagi Kesehatan Mental
Penting untuk diingat bahwa FOMO tidak sama dengan keinginan untuk berinteraksi secara sosial dan menikmati pengalaman baru. FOMO lebih berkaitan dengan kecemasan dan takut kehilangan pengalaman orang lain. FOMO dapat memengaruhi orang pada berbagai tingkatan, dari merasa tertekan secara ringan hingga terpengaruh secara serius pada kesehatan mental.
Beberapa dampak negatif FOMO pada kesehatan mental diantaranya adalah:
1. Kecemasan dan Stres 
FOMO dapat menyebabkan seseorang merasa cemas dan stres karena mereka khawatir kehilangan pengalaman yang menyenangkan yang dimiliki oleh orang lain. Kecemasan dan stres ini dapat menyebabkan gangguan tidur, kecemasan berlebihan, dan bahkan depresi.
2. Perasaan Tidak Puas
FOMO dapat membuat seseorang merasa tidak puas dengan hidupnya. Mereka merasa bahwa kehidupan orang lain lebih baik daripada mereka dan merasa tidak senang dengan diri mereka sendiri. Hal ini dapat mempengaruhi harga diri dan kepercayaan diri seseorang, yang pada akhirnya akan berdampak pada kesehatan mental mereka.
3. Kehilangan Kepuasan dalam Hidup 
FOMO dapat membuat seseorang merasa tidak puas dengan kehidupan mereka saat ini. Mereka mungkin merasa bahwa mereka melewatkan pengalaman yang lebih baik dan tidak dapat menikmati hidup mereka sekarang. Hal ini dapat mempengaruhi kualitas hidup seseorang dan membuat mereka merasa tidak bahagia.
4. Mengganggu Produktivitas dan Konsentrasi 
FOMO dapat mengganggu konsentrasi seseorang dan membuat mereka sulit untuk fokus pada tugas yang sedang dilakukan. Mereka mungkin terus memeriksa media sosial untuk melihat apa yang sedang terjadi di dunia, atau memikirkan pengalaman sosial yang mereka lewatkan. Hal ini dapat mempengaruhi produktivitas dan kinerja mereka di tempat kerja atau di sekolah.
5. Memicu Perilaku Negatif 
FOMO dapat memicu perilaku negatif seperti penggunaan obat-obatan, minuman beralkohol, atau perilaku berisiko lainnya. Seseorang mungkin merasa perlu untuk mengalami hal-hal yang sedang populer atau bergabung dalam perilaku yang dapat membahayakan kesehatan mereka.
Cara Mengelola FOMO
FOMO dapat memiliki dampak yang signifikan pada kesehatan mental seseorang dan dapat mempengaruhi kualitas hidup mereka. Oleh karena itu, penting untuk belajar bagaimana mengelola FOMO dengan tepat. 
1. Sadari Bahwa FOMO Adalah Hal yang Wajar
Pertama-tama, penting untuk diingat bahwa FOMO adalah hal yang wajar dan banyak orang mengalaminya. Mengakui bahwa FOMO adalah hal yang normal dapat membantu mengurangi tekanan yang Kamu rasakan.
2. Fokus pada Prioritas dan Tujuan Kamu
Memprioritaskan hal-hal yang penting dalam hidup Kamu dapat membantu Kamu merasa lebih puas dan mengurangi kecenderungan untuk membandingkan hidup Kamu dengan hidup orang lain. 
3. Kurangi Penggunaan Media Sosial
Terus-menerus memeriksa media sosial untuk membandingkan hidup Kamu dengan hidup orang lain hanya akan memperburuk kecenderungan FOMO. Cobalah untuk mengurangi penggunaan media sosial atau bahkan berhenti sepenuhnya jika Kamu merasa itu terlalu mempengaruhi kesehatan mental Kamu.
Itulah dampak negatif FOMO bagi kesehatan mental. Jika kamu merasakan kondisi FOMO sudah berdampak negatif terhadap diri, segera untuk mengonsultasikan kepada dokter terapis sebelum kondisi FOMO merenggut kesehatan mental kita. 
Kamu dapat berkonsultasi mengenai dampak FOMO lebih lanjut dengan dokter terapis melalui Halodoc. Ayo segera download Halodoc untuk menjaga kesehatan mental kamu.

Referensi:
Forbes Health. Diakses pada 2023. The Psychology Behind The Fear of Missing Out (FOMO)
The Odyssey. Diakses pada 2023. The Adverse Effects Of “FOMO”
Very Well Mind. Diakses pada 2023. How to Deal With FOMO in Your Life",dr. Rizal Fadli,16 Maret 2023,"[""kesehatan mental""]",https://www.halodoc.com/artikel/5-dampak-negatif-fomo-bagi-kesehatan-mental,0,0
6526dd44-0044-11ee-81cc-bb155eb672e5,"Waspada, Ini Dampak Bullying pada Kesehatan Mental Anak","“Bullying merupakan fenomena yang kerap kali terjadi di lingkungan anak-anak dan remaja. Dampak bullying  bisa menyebabkan anak menjadi tidak percaya diri, mengalami gangguan kecemasan, hingga memicu keinginan bunuh diri”.",https://d1vbn70lmn1nqe.cloudfront.net/prod/wp-content/uploads/2023/03/03062153/Dampak-Bullying-pada-Kesehatan-Mental-Anak.jpg.webp,"Halodoc, Jakarta – Perundungan atau bullying di sekolah sepertinya telah menjadi fenomena yang kerap kali terjadi pada anak-anak atau remaja.
Bullying sekecil apa pun tidak bisa dinormalisasikan, karena akan berdampak pada kesehatan mental anak. Sebaiknya orang tua mengetahui dampak bullying yang berbahaya bagi kesehatan mental anak.
Dampak Bullying pada Anak
Bullying merupakan salah satu faktor penyebab gangguan kesehatan mental pada anak atau remaja. Ketika anak di-bully mereka cenderung merasa stress atau depresi. 
Sayangnya, masih banyak orang tua yang menyepelekan hal ini, sehingga anak menjadi ragu untuk menceritakan pengalaman perundungan yang dirasakan saat di sekolah. 
Nah, berikut beberapa dampak bullying pada anak yang perlu diwaspadai:
1. Kehilangan kepercayaan diri
Salah satu efek pertama yang dirasakan pada anak-anak dan remaja jika mereka di-bully adalah hilangnya kepercayaan diri. Mereka mulai merasa dirinya tidak sebaik orang yang menindas mereka, dan merasa tidak pantas untuk mencoba aktivitas tertentu.
Hilangnya kepercayaan diri ini dapat mempengaruhi aspek kehidupan lainnya, seperti ragu untuk memulai hal baru atau takut untuk berkenalan dengan teman baru.  
2. Meningkatnya self-criticism
Self-criticism atau kritik diri merupakan perilaku ketika anak mulai mengkritik atau berpikiran negatif tentang dirinya sendiri. Anak yang mengalami bullying sering kali bersikap keras pada diri mereka. 
Mereka mungkin sering mendengar pernyataan negatif dari pem-bully sehingga mereka mulai menganggap bahwa pernyataan itu benar. Mereka mulai merasa buruk tentang sesuatu yang tidak mungkin berubah. Contohnya, seperti kondisi fisik misalnya warna kulit, tinggi badan, atau berat badan.  
3. Mulai mengisolasi diri
Anak-anak yang menjadi korban bullying sering merasa sangat buruk terhadap diri mereka, sehingga mereka mencoba mengasingkan diri dari lingkungannya. Mereka mencoba untuk menghindari interaksi dengan teman sebaya, teman sekelas, atau anggota keluarga. 
Mereka juga cenderung menutup diri saat di rumah dan mencoba menghindari masuk sekolah dimana perundungan terjadi. Jika anak terus mengisolasi diri dan menghindari interaksi sosial, maka sulit bagi anak untuk membangun hubungan pertemanan di masa depan.
4. Kesehatan mental yang buruk
Dampak negatif utama dari bullying adalah menurunnya kesehatan mental. Gangguan mental yang bisa ditimbulkan dari bullying adalah gangguan kecemasan (anxiety), depresi, kesulitan untuk tidur, dan bahkan perilaku menyakiti diri sendiri (self-harm). 
Walaupun gangguan ini kemungkinan memudar seiring berjalannya waktu, tapi  bukan berarti anak akan melupakan perundungan yang pernah terjadi pada dirinya.
Menurut penelitian, anak-anak yang mengalami bullying berisiko lebih tinggi mengalami masalah kesehatan mental saat mereka tumbuh dewasa.
Jika Ibu ingin mengetahui depresi pada anak akibat bullying, silahkan baca kunjungi artikel ini, “Ibu, Ini Cara Mengenali Depresi pada Anak Akibat Bullying”
5. Pikiran untuk bunuh diri
Fenomena bullying dan tindakan percobaan bunuh diri memiliki kaitan yang erat. Bukan tanpa alasan, pasalnya banyak korban yang memutuskan untuk mengakhiri hidupnya karena tidak kuat mendapatkan perundungan terus-menerus. 
Kondisi ini disebabkan karena korban bullying sudah tidak sanggup merasakan tekanan emosional, dan sudah merasa putus asa akibat perundungan.
Selain itu, kurangnya dukungan dari keluarga, bantuan dari pihak sekolah, hingga tidak adanya bantuan psikologis, juga bisa memicu tindakan bunuh diri pada korban bullying.
Nah, tidak main-main bukan dampak bullying pada kesehatan mental anak? Jika Ibu ingin berkonsultasi mengenai kesehatan mental anak, Ibu bisa segera konsultasikan ke psikiater melalui Halodoc. Ayo segera download Halodoc untuk deteksi kesehatan mental yang lebih baik. 

Referensi:
Mcleanhospital. Diakses pada 2023. The Mental Health Impact of Bullying on Kids and Teens.
WebMD. Diakses pada 2023. How Does Bullying Affect Mental Health?
CDC. Diakses pada 2023. The Relationship Between Bullying and Suicide: What We Know and What it Means for Schools",dr. Rizal Fadli,03 Maret 2023,"[""kesehatan mental""]",https://www.halodoc.com/artikel/waspada-ini-dampak-bullying-pada-kesehatan-mental-anak,0,0
